Book Id,Title,Author,Author l-f,Additional Authors,ISBN,ISBN13,My Rating,Average Rating,Publisher,Binding,Number of Pages,Year Published,Original Publication Year,Date Read,Date Added,Bookshelves,Bookshelves with positions,Exclusive Shelf,My Review,Spoiler,Private Notes,Read Count,Owned Copies,PublishedDate,PageCount,Categories,AverageRating,RatingsCount,Description
32855119,"Die Eule von Askir (Das Geheimnis von Askir, #6)",Richard Schwartz,"Schwartz, Richard",,9783492975063,"=""""",4,4.43,Piper ebooks,Kindle Edition,688.0,2016.0,2009.0,,2017/05/06,,,read,,,,1,0,2016-11-02,688,Fiction,,,"Endlich liegt die Saga um ""Die Eule von Askir"" in der ursprünglichen Fassung vor, wie der Autor sie erdacht hatte. In der umfassenden und ungekürzten Form können alle Richard-Schwartz-Fans das Abenteuer ganz neu erleben: Am Hafen der altehrwürdigen Stadt Askir wird ein bestialisch zugerichteter Toter gefunden. Es ist der Botschaftsdiener Jenks, der in diesem zwielichtigen Viertel eigentlich nichts zu suchen hatte. Stabsleutnant Santer wird mit den Ermittlungen betraut, unterstützt durch die faszinierende Magierin Desina. Diese hat die Gabe, die Vergangenheit vor ihren Augen neu erstehen zu lassen. Doch was Desina in der Nacht des Mordes erblickt, bedeutet für ganz Askir eine unberechenbare Bedrohung. Denn der Feind beherrscht schwarze Magie, gegen die alle Mittel Desinas machtlos sind."
61907,Der Kadett,Lois McMaster Bujold,"Bujold, Lois McMaster",Edda Petri,3453066022,"=""9783453149076""",5,4.27,,Paperback,380.0,1999.0,1986.0,1996/05/09,2015/05/09,,,read,,,,1,0,1993,380,,,,
2180460,Cordelias Ehre,Lois McMaster Bujold,"Bujold, Lois McMaster",Michael Morgental,3453520017,"=""9783453520011""",3,4.33,,Mass Market Paperback,592.0,2004.0,1996.0,1996/05/09,2015/05/09,,,read,,,,1,0,2004,592,,,,
61905,"Barrayar (Vorkosigan Saga, #7)",Lois McMaster Bujold,"Bujold, Lois McMaster",,,"=""9780743468411""",3,4.29,,Paperback,336.0,2003.0,1991.0,1996/05/09,2015/05/09,,,read,,,,1,0,,,,,,
3006201,Barrayar: Der Botschafter,Lois McMaster Bujold,"Bujold, Lois McMaster",,3453521277,"=""9783453521278""",3,4.52,,Paperback,959.0,2006.0,2008.0,1996/05/09,2015/05/09,,,read,,,,1,0,2006,959,,,,
15831078,"Scherben der Ehre (Barrayar-Zyklus, #1)",Lois McMaster Bujold,"Bujold, Lois McMaster",Michael Morgental,,"=""9783453128101""",2,4.08,,Paperback,335.0,1997.0,1986.0,1996/05/09,2015/05/09,,,read,,,,1,0,,,,,,
13536649,"Trapped (The Iron Druid Chronicles, #5)",Kevin Hearne,"Hearne, Kevin",,9780345535627,"=""9780345533647""",0,4.27,Del Rey,Mass Market Paperback,290.0,2012.0,2012.0,,2023/08/19,to-read,to-read (#140),to-read,,,,0,0,2012-11-27,320,Fiction,,,"After twelve years of secret training, Atticus O’Sullivan is finally ready to bind his apprentice, Granuaile, to the earth and double the number of Druids in the world. But on the eve of the ritual, the world that thought he was dead abruptly discovers that he’s still alive, and they would much rather he return to the grave. Having no other choice, Atticus, his trusted Irish wolfhound, Oberon, and Granuaile travel to the base of Mount Olympus, where the Roman god Bacchus is anxious to take his sworn revenge—but he’ll have to get in line behind an ancient vampire, a band of dark elves, and an old god of mischief, who all seem to have KILL THE DRUID at the top of their to-do lists. Don’t miss any of Kevin Hearne’s phenomenal Iron Druid Chronicles novels: HOUNDED | HEXED | HAMMERED | TRICKED | TRAPPED | HUNTED | SHATTERED | STAKED"
12700306,"Tricked (The Iron Druid Chronicles, #4)",Kevin Hearne,"Hearne, Kevin",,9780345534637,"=""9780345533623""",4,4.25,Del Rey,Mass Market Paperback,341.0,2012.0,2012.0,,2023/08/19,currently-reading,currently-reading (#1),currently-reading,,,,2,0,2012-04-24,390,Fiction,4,9,"Druid Atticus O’Sullivan hasn’t stayed alive for more than two millennia without a fair bit of Celtic cunning. So when vengeful thunder gods come Norse by Southwest looking for payback, Atticus, with a little help from the Navajo trickster god Coyote, lets them think that they’ve chopped up his body in the Arizona desert. But the mischievous Coyote is not above a little sleight of paw, and Atticus soon finds that he’s been duped into battling bloodthirsty desert shapeshifters called skinwalkers. Just when the Druid thinks he’s got a handle on all the duplicity, betrayal comes from an unlikely source. If Atticus survives this time, he vows he won’t be fooled again. Famous last words. Don’t miss any of Kevin Hearne’s phenomenal Iron Druid Chronicles novels: HOUNDED | HEXED | HAMMERED | TRICKED | TRAPPED | HUNTED | SHATTERED | STAKED"
24662202,"Gehämmert (Die Chronik des eisernen Druiden, #3)",Kevin Hearne,"Hearne, Kevin","Alexander Wagner, Friedrich Mader",9783608107838,"=""9783608939330""",5,4.21,Klett-Cotta,Paperback,366.0,2015.0,2011.0,2015/05/11,2015/05/09,,,read,"Naja, es gibt teilweise interessante Ideen in dem Buch. Aber es wirkt alles billig und durchsichtig gemacht. Wenn ich Kevin Hearne mit Jim Butcher vergleiche und irgendwie werde ich das Gefühl nicht los, das Hearne abgekupfert hat, dann würde ich klar Butcher empfehlen.<br/><br/>Hat mich nicht umgehauen. ",,,1,0,2015-03-10,368,Fiction,,,"Thor, der nordische Donnergott, ist nicht nur ein Aufschneider und Rüpel, sondern viel schlimmer. Er hat viele Leben vernichtet und unzählige Unschuldige auf dem Gewissen. Atticus O'Sullivan, der letzte der Druiden, und sein vampirischer Anwalt Leif unternehmen alles, um diesen nordischen Albtraum ein für alle Mal loszuwerden. Über 2.000 Jahre hat eine Überlebensstrategie für Atticus funktioniert: Halt dich fern von Thor! Aber die Dinge heizen sich auf in seiner neuen Heimat Tempe, Arizona. Russische Dämonenjäger, die sich selbst die ""Hämmer Gottes"" nennen, drehen komplett durch und terrorisieren die Gegend. Doch wer steckt dahinter? Trotz vielfacher Warnung reisen Atticus und Leif zur nordischen Welt Asgard, wo sie sich mit einem Werwolf, einem Zauberer und einer Armee von Eisriesen verbünden. Ein epischer Kampf gegen boshafte Walküren, zornige Götter und – vor allem – gegen den hammerschwingenden Donner-Fiesling selbst beginnt."
9595650,"Hexed (The Iron Druid Chronicles, #2)",Kevin Hearne,"Hearne, Kevin",,9780732292911,"=""9780345522498""",4,4.22,HarperCollins Australia,Mass Market Paperback,296.0,2011.0,2011.0,,2023/08/19,,,read,,,,1,0,2011,18,Druids and druidism,,,2 100-year old Atticus O'Sullivan last of the Druids discovers that he is in high demand after killing an ancient Celtic god. Gods from many other pantheons want him to knock off their rivals and everyone -- even his lawyer -- wants him to teach Thor the Norse thunder god a fatal lesson.
9533378,"Hounded (The Iron Druid Chronicles, #1)",Kevin Hearne,"Hearne, Kevin",,9780345522535,"=""9780345522474""",4,4.09,Del Rey,Mass Market Paperback,304.0,2011.0,2011.0,,2023/08/19,,,read,,,,1,0,2011-05-03,318,Fiction,4.5,12,"The first novel in the New York Times bestselling Iron Druid Chronicles—the hilarious, action-packed tales of a two-thousand-year-old Druid pursued by ancient gods in the modern world “A page-turning and often laugh-out-loud-funny caper through a mix of the modern and the mythic.”—Ari Marmell, author of The Warlord’s Legacy Atticus O’Sullivan is the last of the ancient druids. He has been on the run for more than two thousand years and he’s tired of it. The Irish gods who want to kill him are after an enchanted sword he stole in a first-century battle, and when they find him managing an occult bookshop in Tempe, Arizona, Atticus doesn’t want to uproot his life again. He just wants everything to end one way or another, but preferably the way in which he can continue to enjoy fish and chips. He does have some small hope of survival: The Morrigan, the Irish Chooser of the Slain, is on his side, and so is Brighid, First Among the Fae. His lawyer is literally a bloodsucking vampire, and he has a loyal Irish wolfhound with opinions about poodles. But he’s facing down some mighty enemies: Aenghus Óg, a vengeful Irish god, plus a coven of witches and even the local police. On top of all that, Aenghus has a direct line to the firepower of hell. Atticus will need all the luck of the Irish and more if he’s going to stay alive. Don’t miss any of The Iron Druid Chronicles: HOUNDED | HEXED | HAMMERED | TRICKED | TRAPPED | HUNTED | SHATTERED | STAKED | SCOURGED | BESIEGED"
8479967,"Zauberlehrling voller Fehl und Adel (Trix Solier, #1)",Sergei Lukyanenko,"Lukyanenko, Sergei",Christiane Pöhlmann,,"=""9783407810748""",0,3.76,,Hardcover,581.0,2010.0,2009.0,,2019/12/30,to-read,to-read (#139),to-read,,,,1,0,,,,,,
52530174,Das Feuer der Dämonen (Demon Cycle),Peter V. Brett,"Brett, Peter V.",,3453320530,"=""9783453320536""",5,4.2,,Paperback,542.0,2019.0,2019.0,,2019/10/09,,,read,,,,1,0,2019,,,,,
35015460,"Zeitenfeuer (The First Empire, #2)",Michael J. Sullivan,"Sullivan, Michael J.",Marcel Aubron-Bülles,3426520346,"=""9783426520345""",4,4.29,,Paperback,624.0,2018.0,2017.0,,2019/10/20,,,read,,,,1,0,2018-03-01,624,,,,
9676849,"Dreadnaught (The Lost Fleet: Beyond the Frontier, #1)",Jack Campbell,"Campbell, Jack",,0857681362,"=""9780441020379""",3,4.05,Titan Publishing Company,Hardcover,356.0,2011.0,2011.0,2017/01/08,2017/01/08,,,read,,,,1,0,2011,0,"Geary, John (Fictitious character)",,,"The Alliance woke Captain John ""Black Jack"" Geary from cryogenic sleep to take command of the fleet in the century-long conflict against the Syndicate Worlds. Now Admiral Geary's victory has earned him the adoration of the people--and the enmity of politicians convinced that a living hero can be a very inconvenient thing. The war may be over, but Geary and his newly christened First Fleet have been ordered back into action to investigate the aliens occupying the far side of Syndic space and to determine how much of a threat they represent to the Alliance. And while the Syndic Worlds are no longer united, individually they may be more dangerous than ever before. Geary knows that members of the military high command and the government question his loyalty to the Alliance and fear his staging a coup--so he can't help but wonder if the fleet is being deliberately sent on a suicide mission."""
13497841,Die Insel der besonderen Kinder,Ransom Riggs,"Riggs, Ransom",Silvia Kinkel,9783426411957,"=""9783426411957""",3,3.92,Knaur eBook,ebook,416.0,2011.0,2011.0,2015/05/09,2015/05/09,,,read,,,,1,0,2011-11-02,297,Fiction,,,"Eine geheimnisvolle Insel. Ein verlassenes Waisenhaus. Eine Sammlung merkwürdiger Fotografien. Das alles wartet darauf, in »Die Insel der besonderen Kinder« entdeckt zu werden, einem unvergesslichen Roman, der Fiktion und Vintage-Fotografien zu einem spannenden Leseerlebnis für Jung und Alt verbindet. Manche Großeltern lesen ihren Enkeln Märchen vor. Aber was Jacob von seinem Opa hörte, war etwas ganz anderes: Abraham erzählte ihm von einer Insel, auf der abenteuerlustige Kinder mit besonderen Fähigkeiten leben, und von Monstern, die auf der Suche nach ihnen sind. Als Abraham unter mysteriösen Umständen stirbt, betritt der sechzehnjährigen Jacob eine abgelegene Insel vor der Küste von Wales, um mehr über die seltsamen Geschichten seines Großvaters zu erfahren. Bald findet er sich in einer Welt wieder, in der die Zeit stillsteht und er die ungewöhnlichsten Freundschaften schließt, die man sich vorstellen kann. Doch auch die Ungeheuer sind höchst real – und sie sind ihm gefolgt ... Der erste Band der erfolgreichen Fantasy-Reihe rund um Jacob Portman und die besonderen Kinder. Die komplette Fantasy-Reihe des amerikanischen Bestseller-Autors Ransom Riggs im Überblick: Band 1 - Die Insel der besonderen Kinder Band 2 - Die Stadt der besonderen Kinder Band 3 - Die Bibliothek der besonderen Kinder Band 4 - Der Atlas der besonderen Kinder Band 5 - Das Vermächtnis der besonderen Kinder Band 6 - Die Zukunft der besonderen Kinder Bonus - Die Legenden der besonderen Kinder"
9397145,Tschick,Wolfgang Herrndorf,"Herrndorf, Wolfgang",,9783644107816,"=""9783871347108""",4,3.59,Rowohlt Verlag GmbH,Hardcover,254.0,2010.0,2010.0,,2019/12/31,,,read,,,,1,0,2011-02-01,283,Fiction,3,7,"Zwei Jungs. Ein geknackter Lada. Eine Reise voller Umwege durch ein unbekanntes Deutschland. Mutter in der Entzugsklinik, Vater mit Assistentin auf Geschäftsreise: Maik Klingenberg wird die großen Ferien allein am Pool der elterlichen Villa verbringen. Doch dann kreuzt Tschick auf. Tschick, eigentlich Andrej Tschichatschow, kommt aus einem der Asi-Hochhäuser in Hellersdorf, hat es von der Förderschule irgendwie bis aufs Gymnasium geschafft und wirkt doch nicht gerade wie das Musterbeispiel der Integration. Außerdem hat er einen geklauten Wagen zur Hand. Und damit beginnt eine unvergessliche Reise ohne Karte und Kompass durch die sommerglühende deutsche Provinz. «Auch in fünfzig Jahren wird dies noch ein Roman sein, den wir lesen wollen. Aber besser, man fängt gleich damit an.» (Felicitas von Lovenberg, Frankfurter Allgemeine Zeitung)."
7200884,"Victorious (The Lost Fleet, #6)",Jack Campbell,"Campbell, Jack",,9781101187029,"=""9780441018697""",4,4.1,Penguin,Mass Market Paperback,352.0,2010.0,2010.0,2017/01/08,2017/01/08,,,read,,,,1,0,2010-04-27,352,Fiction,4,4,"The Lost Fleet: Relentless found its way onto the New York Times bestseller list... Now Victorious leads the charge again-and ""Black Jack"" Geary is in command... As war continues to rage between the Alliance and Syndicate Worlds, Captain ""Black Jack"" Geary is promoted to admiral-even though the ruling council fears he may stage a military coup. His new rank gives him the authority to negotiate with the Syndics, who have suffered tremendous losses and may finally be willing to end the war. But an even greater alien threat lurks on the far side of the Syndic occupied space."
2341319,"Valiant (The Lost Fleet, #4)",Jack Campbell,"Campbell, Jack",,9781440637568,"=""9780441016198""",3,4.0,Penguin,Mass Market Paperback,284.0,2008.0,2008.0,2017/01/08,2017/01/08,,,read,,,,1,0,2008-06-24,304,Fiction,4,2,"Legendary war hero Captain “Black Jack” Geary fights to stay ahead of his enemies in the fourth novel in Jack Campbell’s New York Times bestselling military science fiction series. Deep within Syndicate World space, the Alliance fleet continues its dangerous journey home under the command of Captain John “Black Jack” Geary—revived after a century spent in suspended animation. Geary’s victories over the enemy have earned both the respect—and the envy—of his fellow officers... Geary has made many risky decisions as commander of the Alliance fleet, but ordering them back to the Lakota Star System where the Syndics nearly destroyed them has his officers questioning his sanity. It’s a desperate gamble that may buy the fleet just enough time to prepare for the Syndics’ inevitable return. Even as he struggles to give the fleet a fighting chance at survival, Geary faces dissent from within. An unknown number of officers want a change of command, but Geary knows that the Alliance fleet must stand together, or else the Syndic forces will tear them apart..."
96594,"Fearless (The Lost Fleet, #2)",Jack Campbell,"Campbell, Jack",,9781101147276,"=""9780441014767""",4,3.99,Penguin,Mass Market Paperback,295.0,2007.0,2007.0,2017/01/08,2017/01/08,,,read,,,,1,0,2007-01-30,306,Fiction,4.5,2,"Captain John “Black Jack” Geary tries a desperate gamble to lead the Alliance Fleet home through enemy-occupied space in this novel in the thrilling Lost Fleet series. Geary is convinced that the Syndics are planning to ambush the fleet and finish it off once and for all. Realizing the fleet’s best (and only) chance is to do the unexpected, Geary takes the offensive and orders the fleet to the Sancere system. There, a multitude of possible routes home give the Alliance fleet a better chance of avoiding their pursuers—and an attack on the Sancere shipbuilding facilities could decimate the Syndic war effort. Weary from endless combat, the officers and crew of the Alliance fleet can’t see the sense in charging deeper into enemy territory—prompting a mutiny that divides them, and leaving Geary with the odds higher against him than ever before..."
112292,"Dauntless (The Lost Fleet, #1)",Jack Campbell,"Campbell, Jack",,9781101147016,"=""9780441014187""",3,3.96,Penguin,Mass Market Paperback,293.0,2006.0,2006.0,2017/01/08,2016/10/15,,,read,,,,1,0,2006-06-27,308,Fiction,,,"Captain John “Black Jack” Geary’s legendary exploits are known to every schoolchild. Revered for his heroic “last stand” in the early days of the war, he was presumed dead. But a century later, Geary miraculously returns from survival hibernation and reluctantly takes command of the Alliance Fleet as it faces annihilation by the Syndic. Appalled by the hero-worship around him, Geary is nevertheless a man who will do his duty. And he knows that bringing the stolen Syndic hypernet key safely home is the Alliance’s one chance to win the war. But to do that, Geary will have to live up to the impossibly heroic “Black Jack” legend..."
1372055,"Courageous (The Lost Fleet, #3)",Jack Campbell,"Campbell, Jack",,085768132X,"=""9780441015672""",4,3.99,Titan Publishing Company,Mass Market Paperback,299.0,2007.0,2007.0,2017/01/08,2017/01/08,,,read,,,,1,0,2011,0,Imaginary wars and battles,,,"Captain John ""Black Jack"" Geary, jumping from system to system to keep one step ahead of the Syndics, stumbles upon fragments of intelligence that expose the existence of another potential player in the war that has the means to destroy the human race."
13607623,"Schiffsdiebe (Ship Breaker, #1)",Paolo Bacigalupi,"Bacigalupi, Paolo",,9783641073121,"=""9783453529199""",0,3.75,Heyne Verlag,Klappenbroschur,352.0,2012.0,2010.0,,2019/12/30,to-read,to-read (#137),to-read,,,,1,0,2012-03-05,206,Fiction,5,1,"Ein junger Held, eine gefährliche Welt und ein unvergessliches Abenteuer Amerika in nicht allzu ferner Zukunft: Die letzten Ölquellen sind versiegt, der Meeresspiegel ist stark angestiegen, und das Land wird beinahe täglich von verheerendenUnwettern heimgesucht. In dieser Welt sind die Wracks der großen Tanker, die entlang der Golfküste stranden, die Lebensgrundlage für Nailer und seine Freunde. Sie kriechen in das Innere der Schiffe und suchen nach Kupfer und anderen wertvollen Materialien. Es ist ein harter Job, bei dem niemand auf den anderen Rücksicht nimmt und jeder versucht, der Schnellste zu sein. Eines Tages erreicht Nailer als Erster einen nach einem Hurrikan gekenterten Klipper – ein Glücksfall, der ihn auf einen Schlag aus der Armut befreien könnte. Aber im Bauch des Schiffs ist ein Mädchen gefangen. Und Nailer steht vor einer folgenschweren Entscheidung – denn wenn er das Mädchen rettet, ist der wertvolle Fund für ihn verloren ..."
20261876,Unrast,Olga Tokarczuk,"Tokarczuk, Olga",Esther Kinsky,9783311150169,"=""""",0,3.76,Kampa Verlag AG,Paperback,464.0,2009.0,2007.0,,2019/12/31,to-read,to-read (#138),to-read,,,,1,0,2021-02-25,26,Fiction,,,"Eryk hat es in den hohen Norden verschlagen, wo er als Steuermann auf einer kleinen Fähre die immer gleiche Route fährt, bis er irgendwann Kurs aufs offene Meer nimmt. Eine Ich-Erzählerin ist unentwegt auf Wanderschaft – zu Fuß, im Auto, im Flugzeug oder gar in Gedanken. Chopins Schwester, die ihren Bruder abgöttisch geliebt hat, begleitet sein Herz auf eine letzte Reise …Unrast ist ein Roman über die Sehnsucht, sich in der Welt zu verlieren, ein Roman über das Reisen und dabei selbst wie eine Reise: mit unzähligen Orten und Menschen, die einem ans Herz wachsen oder die man gerne zurücklässt. Ein Buch voller Bewegungen, Eindrücke, Gedanken und Geschichten, die, wie der Leser bald ahnt, einem geheimen Fahrplan folgen und eine gemeinsame Destination haben. »Hier ist eine, die sich nicht auf ein Genre festlegen will, auch nicht auf einen Stil. Das Patchworkhafte, das Unstete und die Minuteneinsicht sind das Verbindende, selbst Tokarczuks Sprache – im melodischen und souveränen Deutsch ihrer Übersetzerin Esther Kinsky – hat etwas Schlenderndes.« Elke Schmitter / Der Spiegel"
32065466,Aurora,Kim Stanley Robinson,"Robinson, Kim Stanley",Jakob Schmidt,9780316378741,"=""9783453317246""",0,3.76,Hachette UK,Paperback,560.0,2016.0,2015.0,,2019/12/30,to-read,to-read (#136),to-read,,,,1,0,2015-07-07,373,Fiction,,,"A major new novel from one of science fiction's most powerful voices, Aurora tells the incredible story of our first voyage beyond the solar system. Brilliantly imagined and beautifully told, it is the work of a writer at the height of his powers. Our voyage from Earth began generations ago. Now, we approach our new home. AURORA."
42198792,Frontal,John Scalzi,"Scalzi, John",Bernhard Kempen,9783104905495,"=""""",0,4.0,S. Fischer Verlag,Kindle Edition,369.0,2018.0,2018.0,,2019/12/30,to-read,to-read (#134),to-read,,,,1,0,2018-10-17,302,Fiction,,,"Ein Zukunftsthriller vom Autor der Bestseller »Krieg der Klone« und »Kollaps« Kennen Sie Hilketa? Bei dieser Sportart gehen die Spieler mit Schwertern und Hämmern aufeinander los. Das Hauptziel des Spiels: Erbeute den Kopf deines Gegners und befördere ihn durch die Torpfosten. Für gewöhnliche Menschen wäre ein solcher Sport unmöglich. Aber alle Spieler sind »Threeps«, roboterartige Körper, die ferngesteuert werden. Alles ist erlaubt. Bis ein Starathlet, der einen solchen Threep steuert, während eines Spiels zu Tode kommt. Ist es ein Unfall oder Mord? Die beiden FBI-Agenten Chris Shane und Leslie Vann werden zu Hilfe gerufen, um die Wahrheit aufzudecken. Bald verschlägt es sie auf die dunkle Seite des Erfolgssports Hilketa, bei dem Vermögen gemacht und verloren werden und bei dem Spieler wie Macher alles tun, um zu gewinnen – auf dem Feld und außerhalb. Ein in sich abgeschlossener Roman aus derselben Zukunftswelt wie »Das Syndrom«. »John Scalzi ist der unterhaltsamste und zugänglichste SF-Autor unserer Zeit.« Joe Hill"
55400,"Blood Follows (The Tales of Bauchelain and Korbal Broach, #1)",Steven Erikson,"Erikson, Steven",,,"=""9781597800044""",0,3.83,,Hardcover,121.0,2005.0,2002.0,,2019/12/30,to-read,to-read (#135),to-read,,,,1,0,,,,,,
40493285,NSA - Nationales Sicherheits-Amt,Andreas Eschbach,"Eschbach, Andreas",,9783732560615,"=""9783785726259""",0,3.93,BASTEI LÜBBE,Hardcover,796.0,2018.0,2018.0,,2019/10/10,to-read,to-read (#131),to-read,,,,1,0,2018-09-28,832,Fiction,4,3,"Weimar 1942: Die Programmiererin Helene arbeitet im NSA, dem Nationalen-Sicherheitsamt, und entwickelt dort Komputer-Programme, mit deren Hilfe alle Bürger überwacht werden. Erst als die Liebe ihres Lebens Fahnenflucht begeht und untertauchen muss, widersetzt Helene sich. Dabei muss sie nicht nur gegen das Regime kämpfen, sondern auch gegen ihren Vorgesetzten Lettke, der die perfekte Überwachungstechnik des Staates für ganz eigene Zwecke benutzt und dabei zunehmend jede Grenze überschreitet ..."
38709,"Holes (Holes, #1)",Louis Sachar,"Sachar, Louis",,9780307798367,"=""9780439244190""",0,3.99,Yearling,Paperback,272.0,2000.0,1998.0,,2019/10/20,to-read,to-read (#132),to-read,,,,1,0,2011-06-01,251,Juvenile Fiction,4.5,79,"This groundbreaking classic is now available in a special anniversary edition with bonus content. Winner of the Newbery Medal as well as the National Book Award, HOLES is a New York Times bestseller and one of the strongest-selling middle-grade books to ever hit shelves! Stanley Yelnats is under a curse. A curse that began with his no-good-dirty-rotten-pig-stealing-great-great-grandfather and has since followed generations of Yelnatses. Now Stanley has been unjustly sent to a boys' detention center, Camp Green Lake, where the boys build character by spending all day, every day digging holes exactly five feet wide and five feet deep. There is no lake at Camp Green Lake. But there are an awful lot of holes. It doesn't take long for Stanley to realize there's more than character improvement going on at Camp Green Lake. The boys are digging holes because the warden is looking for something. But what could be buried under a dried-up lake? Stanley tries to dig up the truth in this inventive and darkly humorous tale of crime and punishment —and redemption. Special anniversary edition bonus content includes: A New Note From the Author!; ""Ten Things You May Not Know About HOLES"" by Louis Sachar; and more!"
41555947,Magic for Liars,Sarah Gailey,"Gailey, Sarah",,9781250174604,"=""""",0,3.63,Tor Books,Hardcover,336.0,2019.0,2019.0,,2019/12/22,to-read,to-read (#133),to-read,,,,1,0,2019-06-04,320,Fiction,,,"A 2020 LOCUS AWARD FINALIST FOR BEST FIRST NOVEL Sharp, mainstream fantasy meets compelling thrills of investigative noir in Magic for Liars, a fantasy debut by rising star Sarah Gailey. Ivy Gamble was born without magic and never wanted it. Ivy Gamble is perfectly happy with her life – or at least, she’s perfectly fine. She doesn't in any way wish she was like Tabitha, her estranged, gifted twin sister. Ivy Gamble is a liar. When a gruesome murder is discovered at The Osthorne Academy of Young Mages, where her estranged twin sister teaches Theoretical Magic, reluctant detective Ivy Gamble is pulled into the world of untold power and dangerous secrets. She will have to find a murderer and reclaim her sister—without losing herself. “An unmissable debut.”—Adrienne Celt, author of Invitation to a Bonfire At the Publisher's request, this title is being sold without Digital Rights Management Software (DRM) applied."
33642434,"Der Drachenjäger: Die erste Reise ins Wolkenmeer (Die Reisen ins Wolkenmeer, #1)",Bernd Perplies,"Perplies, Bernd",,,"=""9783596296712""",0,3.81,,Paperback,494.0,2017.0,2017.0,,2017/05/06,to-read,to-read (#128),to-read,,,,1,0,,,,,,
