Book Id,Title,Author,Author l-f,Additional Authors,ISBN,ISBN13,My Rating,Average Rating,Publisher,Binding,Number of Pages,Year Published,Original Publication Year,Date Read,Date Added,Bookshelves,Bookshelves with positions,Exclusive Shelf,My Review,Spoiler,Private Notes,Read Count,Owned Copies,PublishedDate,PageCount,Categories,AverageRating,RatingsCount,Description
25972177,"The Waking Fire (The Draconis Memoria, #1)",Anthony Ryan,"Ryan, Anthony",,9780356506371,"=""9780356506395""",3,4.05,Hachette UK,Hardcover,592.0,2016.0,2016.0,,2018/05/03,,,read,,,,2,0,2016-07-07,443,Fiction,,,"'Fabulous . . . Sure to be another fantasy classic' Huffington Post UK 'The world Ryan has created for his new dragon adventure is a joy to visualise' SciFiNow Claydon Torcreek is a Blood-blessed, able to channel the powers contained in the blood of wild drakes. While his brethren serve as elite spies and assassins, Clay prefers the life of a small-time criminal in the dangerous slums of Carvenport. Yet war is coming, and it seems Clay is going to end up on the losing side - unless he can track down a legendary drake, whose powerful blood might just be enough to achieve victory. Clay has handled many things in his time (most of them illegal) but nothing as priceless as his nation's future. Anthony Ryan - bestselling author of fantasy sensation Blood Song - delivers an action-packed epic fantasy of exploration and adventure, spies and assassins, explosive magic and the furious battle to forge an empire. 'A fascinating world packed with dragons, pirates, political machinations and an interesting magic system to boot' Fantasy Faction 'A marvellous piece of imagination with plenty of twists, a refreshingly different setting, and excellent world-building' Mark Lawrence 'Memorable characters and great action' Django Wexler 'Excellent epic fantasy' BookBag Books by Anthony Ryan: The Draconis Memoria The Waking Fire The Legion of Flame The Empire of Ashes Raven's Shadow Blood Song Tower Lord Queen of Fire Raven's Blade The Wolf's Call The Black Song The Covenant of Steel The Pariah"
28941103,Shadowed Souls,Jim Butcher,"Butcher, Jim","Kerrie L. Hughes, Seanan McGuire, Kevin J. Anderson, Rob Thurman, Tanya Huff, Kat Richardson, Jim C. Hines, Anton Strout, Lucy A. Snyder, Kristine Kathryn Rusch, Erik Scott de Bie",,"=""9780451474995""",3,3.79,,Paperback,338.0,2016.0,2016.0,,2017/05/06,,,read,,,,1,0,,,,,,
9269901,"Für die Krone (Magierdämmerung, #1)",Bernd Perplies,"Perplies, Bernd",,,"=""9783802582646""",3,3.67,,Paperback,448.0,2010.0,2010.0,,2017/05/06,,,read,,,,1,0,,,,,,
19486421,"Skin Game (The Dresden Files, #15)",Jim Butcher,"Butcher, Jim",,,"=""9780451464392""",4,4.56,,Hardcover,454.0,2014.0,2014.0,,2017/01/08,,,read,,,,1,0,,,,,,
2637138,Welcome to the Jungle,Jim Butcher,"Butcher, Jim",Ardian Syaf,,"=""9780345507464""",4,4.1,Dynamite,Hardcover,168.0,2008.0,2008.0,,2017/01/08,,,read,,,,1,0,2014-10-15,24,Comics & Graphic Novels,,,"This original story is set in the New York Times-bestselling world of Jim Butcher's Dresden Files, and is scripted by Butcher himself! When the supernatural world goes out of control, there's only one man to call: Harry Dresden, the only professional wizard in the Chicago phonebook."
18775169,"Monster Hunter Nemesis (Monster Hunter International, #5)",Larry Correia,"Correia, Larry",,9781625792945,"=""9781476736556""",4,4.38,Baen Publishing Enterprises,Hardcover,368.0,2014.0,2014.0,,2017/01/08,,,read,,,,1,0,2014-06-16,368,Fiction,5,2,"#5 in multiple New York Times bestseller Larry Correias Monster Hunter series. Agent Franks of the U.S. Monster Control Bureau is a man of many parts¾parts from other people, that is. Franks is nearly seven feet tall and all muscle. He's nearly indestructible. Plus hes animated by a powerful alchemical substance and inhabited by a super-intelligent spirit more ancient than humanity itself. Good thing hes on our side. More or less. Sworn to serve and protect the United States of America from all monsters by one of the countrys founding fathers, Franks has only one condition to the agreement: no matter what the government learns of him, no matter what is discovered concerning his odd physiology or the alchemy behind the elixir that made him, the government is never, ever allowed to try and make more like him. Such is absolutely forbidden and should the powers-that-be do so, then the agreement is null and void. Project Nemesis: in a secret location, using sophisticated technology and advanced genetic engineering, the director of the very agency Franks works for is making more like him. And the director is not content with making one. Nope, hes making thirteen. Now all bets are off, and Hell hath no fury like a monster betrayed. Particularly if that monster happens to be an undying killing machine capable of taking out vampires and werewolves with one hand tied behind his back. At the publisher's request, this title is sold without DRM (Digital Rights Management). Lexile Score: 800 About Larry Correias Monster Hunter series _[A] no-holds-barred all-out page turner that is part science fiction, part horror, and an absolute blast to read.Ó¾Bookreporter.com _If you love monsters and action, youll love this book. If you love guns, youll love this book. If you love fantasy, and especially horror fantasy, youll love this book.Ó¾Knotclan.com _A gun person who likes science fiction¾or, heck, anyone who likes science fiction¾will enjoy [these books]ãThe plotting is excellent, and Correia makes you care about the charactersãI read both books without putting them down except for workãso whaddaya waitin for? Go and buy someãfor yourself and for stocking stuffers.Ó¾Massad Ayoob About Larry Correias Monster Hunter Vendetta: _This lighthearted, testosterone-soaked sequel to 2009's Monster Hunter International will delight fans of action horror with elaborate weaponry, hand-to-hand combat, disgusting monsters, and an endless stream of blood and body parts.Ó¾Publishers Weekly The Monster Hunter Series Monster Hunter International Monster Hunter Vendetta Monster Hunter Alpha Monster Hunter Legion Monster Hunter Nemesis The Monster Hunters (Omnibus contains Monster Hunter International, Monster Hunter Vendetta, and Monster Hunter Alpha)"
12398719,"Invincible (The Lost Fleet: Beyond the Frontier, #2)",Jack Campbell,"Campbell, Jack",,9781101580783,"=""9781937007454""",3,4.12,Penguin,Hardcover,389.0,2012.0,2012.0,,2017/01/08,,,read,,,,1,0,2012-05-01,400,Fiction,5,1,"Admiral John “Black Jack” Geary was revived from cryogenic sleep to lead the Alliance against the Syndicate Worlds. But his superiors question his loyalty to the regime. Now in command of the First Fleet, he is tasked with exploring the frontier beyond Syndic space, a mission he fears deliberately puts the fleet—and himself—in harm’s way... An encounter with the alien enigmas confirms Geary’s fears. Attacked without warning, he orders the fleet to jump star systems—only to enter the crosshairs of another hostile alien armada. Ignoring the First Fleet’s peaceful communications, this species sends its ships into battle while it guards the exiting jump point with a fortress of incalculable power. Now Geary must find a way to reach the jump point without massive casualties—even though the enigmas could be waiting on the other side…"
31348123,Galaktische Mission,John Scalzi,"Scalzi, John",Bernhard Kempen,9783641186142,"=""""",4,3.99,Heyne Verlag,Kindle Edition,497.0,2016.0,2015.0,,2017/01/08,to-read,to-read (#1),to-read,,,,0,0,2016-08-08,496,Fiction,,,"Mit dem Rücken zur Wand Die Menschen haben ferne Planeten und fremde Welten besiedelt – unter den misstrauischen Augen der Aliens und unter dem Schutz der Kolonialen Union. Wenn diese nun wie geplant aufgelöst wird, wären die menschlichen Kolonien den feindlich gesinnten Aliens hilflos ausgeliefert. Ausgerechnet in dieser prekären Lage taucht ein neuer Feind auf, der Menschen und Aliens gegeneinander ausspielt. Für Lieutenant Harry Wilson beginnt ein Wettlauf gegen die Zeit, denn sollte er nicht herausfinden, wer hinter dem intergalaktischen Intrigenspiel steckt, sind Menschen und Aliens gleichermaßen dem Untergang geweiht ..."
16180352,"The B-Team (The Human Division, #1)",John Scalzi,"Scalzi, John",,9781466830516,"=""9781466830516""",4,4.09,Tor Books,ebook,93.0,2013.0,2013.0,,2017/01/08,,,read,,,,1,0,2013-01-15,93,Fiction,,,"The opening episode of The Human Division, John Scalzi's new thirteen-episode novel in the world of his bestselling Old Man's War. Beginning on January 15, 2013, a new episode of The Human Division will appear in e-book form every Tuesday. Colonial Union Ambassador Ode Abumwe and her team are used to life on the lower end of the diplomatic ladder. But when a high-profile diplomat goes missing, Abumwe and her team are last minute replacements on a mission critical to the Colonial Union's future. As the team works to pull off their task, CDF Lieutenant Harry Wilson discovers there's more to the story of the missing diplomats than anyone expected...a secret that could spell war for humanity. At the Publisher's request, this title is being sold without Digital Rights Management Software (DRM) applied."
6761812,Von Lust und Last literarischen Schreibens. Ein Blick in die Werkstatt deutscher Schriftsteller.,Klaus Modick,"Modick, Klaus",Helmut Mörchen,UOM:39015053476746,"=""9783821808888""",3,3.0,,Paperback,,2001.0,,,2016/01/31,,,read,,,,1,0,2001,160,German literature,,,"Anthologie von Texten, die sich mit den äusseren und inneren Bedingungen der Literaturproduktion befassen."
25823197,S.- Das Schiff des Theseus,J.J. Abrams,"Abrams, J.J.","Doug Dorst, Tobias Schnettler, Bert Schröder",,"=""9783462047264""",4,3.87,,Hardcover,544.0,2015.0,2013.0,2018/03/28,2017/01/08,,,read,,,,1,0,,,,,,
1887018,"Das Erste Horn (Das Geheimnis von Askir, #1)",Richard Schwartz,"Schwartz, Richard",,9783492954525,"=""9783492266062""",5,4.14,Piper Verlag,Paperback,398.0,2008.0,2006.0,,2017/05/06,,,read,,,,1,0,2011-10-25,370,Fiction,,,"Ein verschneiter Gasthof im hohen Norden: Havald, ein Krieger aus dem Reich Letasan, kehrt in dem abgeschiedenen Wirtshaus »Zum Hammerkopf« ein. Auch die undurchsichtige Magierin Leandra verschlägt es hierher. Die beiden ahnen nicht, dass sich unter dem Gasthof uralte Kraftlinien kreuzen. Als der eisige Winter das Gebäude vollständig von der Außenwelt abschneidet, bricht Entsetzen aus: Ein blutiger Mord deutet darauf hin, dass im Verborgenen eine Bestie lauert. Doch wem können Havald und Leandra trauen? Die Spuren führen in das sagenhafte untergegangene Reich Askir ... Ein sensationelles Debüt mit einer intensiven, beklemmenden Atmosphäre, die in der Fantasy ihresgleichen sucht."
29490414,"Der Herr des Turmes (Rabenschatten, #2)",Anthony Ryan,"Ryan, Anthony","Detlef Bierstedt, Hannes Riffel, Birgit Maria Pfaffinger",9783608108378,"=""9783837132328""",4,4.17,Klett-Cotta,MP3 CD,31.0,2015.0,2014.0,,2016/10/15,,,read,,,,1,0,2015-09-24,594,Fiction,,,"»Das Lied des Blutes« hat viele Leser in eine faszinierende Fantasywelt voller Geheimnisse, Gefahren und religiöser Konflikte geführt. Im zweiten Band der Rabenschatten-Trilogie muss Vaelin al Sorna erkennen, dass es vor dem Schicksal kein Entrinnen gibt. Vaelin al Sorna kehrt aus den Schlachten zurück und die schwere Bürde der Erinnerung lastet auf ihm. Nie wieder will er töten. Zu viele haben in König Janus' Krieg ihr Leben gelassen. Nicht nur, dass er für viele, die überlebt haben, das Ziel ihrer Rachegelüste ist. Zum Turmherrn der Nordlande ernannt, möchte er fern aller Intrigen Ruhe finden. Doch der neue König ist schwach und die Feinde des Reiches schmieden ein Bündnis, das mehr und mehr an Macht gewinnt. Wird Vaelin al Sorna, der das Töten hasst und in seiner Loyalität hin und her gerissen ist, doch wieder zum Schwert greifen?"
30319750,"Die Königin der Flammen (Rabenschatten, #3)",Anthony Ryan,"Ryan, Anthony","Sara Riffel, Birgit Maria Pfaffinger",9783608100594,"=""9783608960198""",3,3.7,Klett-Cotta,Hardcover,880.0,2016.0,2015.0,2017/02/06,2016/10/15,,,read,,,,1,0,2016-08-13,841,Fiction,,,"Der spannende Abschlussband der Rabenschatten-Trilogie Der außergewöhnliche Kämpfer Vaelin Al Sorna muss seiner Königin beistehen, ihr Reich zu retten. Der Feind hat jetzt aber einen gefährlichen Mitstreiter, dessen Kräfte unheilvoller sind, als alles, was Vaelin bisher kannte. Und Vaelin spürt, dass seine besondere Gabe, »das Lied« in seinem Blut, langsam verklingt. Wird es noch stark genug sein, um die tückischen Feinde abzuwehren? Nach Königin Lyrnas Rückkehr in die Vereinigten Königslande liegt das Volk ihr zu Füßen. Auf den Schultern von Vaelin Al Sorna lastet dagegen der Siegesruhm schwer. Das besagt auch sein neuer Name: Herr über die Schlachten des Reiches. Derweil zieht im fernen Volaria eine neue Bedrohung auf, die die ganze Welt in Chaos und Vernichtung stürzen könnte. Der grausame »Verbündete« hat überall seine Marionetten und will in allen Ländern die Macht an sich reißen. Menschliches Leben kümmert ihn nicht. Um ihn aufzuhalten, müssen Königin Lyrna, Vaelin und ihre Mitstreiter zu ihrem bislang größten Feldzug aufbrechen, von dem es vielleicht keine Rückkehr mehr gibt."
1778693,"King's Property (Queen of the Orcs, #1)",Morgan Howell,"Howell, Morgan",,9780345500403,"=""9780345496508""",0,3.71,Del Rey,Mass Market Paperback,336.0,2007.0,2007.0,,2017/01/31,to-read,to-read (#8),to-read,,,,0,0,2007-07-31,336,Fiction,5,2,"“Original and vivid. I was captivated.”—Nancy Kress, author of Beggars in Spain Born into hardship, Dar learns to rely on herself alone. When her family betrays her, Dar is conscripted into King Kregant’s army and its brutal campaign to conquer a neighboring country. Now she is bound as a slave to a dreaded regiment of orcs, creatures legendary for their savagery and battle prowess. Rather than cower, Dar rises to the challenge. She learns the unique culture and language of the orcs, survives treachery from both allies and enemies, and struggles to understand a mystical gift that brings her dark, prophetic visions. As the war escalates—amid nightmarish combat and shattering loss—Dar must seize a single chance at freedom."
30177228,"Das Flammende Phantom (Lockwood & Co., #4)",Jonathan Stroud,"Stroud, Jonathan",,9783641187149,"=""9783570159644""",4,4.52,cbj Verlag,Hardcover,512.0,2016.0,2016.0,,2017/01/13,,,read,,,,1,0,2016-11-28,459,Young Adult Fiction,,,"Im vierten Abenteuer um die Geisterjägeragentur Lockwood & Co. bekommen Anthony Lockwood und George es mit einem besonders schrecklichen Verbrechen zu tun. Die Spur hinter dessen dunklem Geheimnis führt sie mitten ins Herz der Londoner Gesellschaft. Um diesen Fall zu klären, müssen sie alle Kräfte mobilisieren und so bitten sie die in Geisterdingen hochbegabte Lucy, als Beraterin in die Agentur zurückzukehren. Doch die Freunde ahnen nicht, wie sehr diese Nachforschungen sie selbst in ihren beruflichen und persönlichen Grundfesten erschüttern werden und dass sie damit Kräfte auf den Plan rufen, die selbst sie nicht mehr kontrollieren können ... Jonathan Stroud schreibt unvergleichlich witzig und ironisch und sorgt mit den spannenden Abenteuern von Lockwood & Co für Gänsehaut und schlaflose Nächte."
26114340,"The Curse of Tenth Grave (Charley Davidson, #10)",Darynda Jones,"Jones, Darynda",,9780349411439,"=""9781250078193""",0,4.38,Hachette UK,Hardcover,342.0,2016.0,2016.0,,2017/01/09,to-read,to-read (#7),to-read,,,,0,0,2016-06-28,352,Fiction,,,"Part-time PI and full-time grim reaper, Charley Davidson has asked a lot of questions throughout her life: Why can I see dead people? Who is the hot supernatural entity following me? How do I get gum out of my sister's hair before she wakes up? But, ""How do I trap not one god, but three?"" was never among them. Until now. And since those gods are on earth to kill her daughter, she has little choice but to track them down, trap them, and cast them from this dimension. But one of them stole her heart a very long time ago. Can a god of absolute death and destruction change his omniscient spots, or will his allegiance lie with his brothers? Those are just some of the questions Charley must answer, and quick. Add to that a homeless girl on the run for her life, a man who's been framed for murdering a woman who is still very much alive, and a pendant made from god glass that has the entire supernatural world in an uproar, Charley has her hands full. If she can manage to take care of the whole world-destroying-gods thing, we're saved. If not, well..."
25776210,"Fire Touched (Mercy Thompson, #9)",Patricia Briggs,"Briggs, Patricia",,9780356501581,"=""9780425256763""",0,4.38,Hachette UK,Hardcover,342.0,2016.0,2016.0,,2017/01/09,to-read,to-read (#6),to-read,,,,0,0,2016-03-08,352,Fiction,5,1,"The ninth novel in the international No. 1 bestselling Mercy Thompson series - the major urban fantasy hit of the decade 'I love these books!' Charlaine Harris 'The best new fantasy series I've read in years' Kelley Armstrong MERCY THOMPSON: MECHANIC, SHAPESHIFTER, FIGHTER Mercy Thompson is back, and she'll soon discover that when the fae stalk the human world, it's the children who suffer . . . Tensions between the fae and humans are coming to a head. And when coyote shapeshifter Mercy and her Alpha werewolf mate, Adam, are called upon to stop a rampaging troll, they find themselves with something that could avert an out-and-out war: a human child stolen long ago by the fae. Defying the most powerful werewolf in the country, the humans and the fae, Mercy, Adam and their pack choose to protect the boy no matter what the cost. But who will protect them from a boy who is fire touched? Praise for the series: 'Plenty of twists and turns . . . Kept me entertained from its deceptively innocent beginning to its can't-put-it-down end' Kim Harrison, bestselling author of Dead Witch Walking 'I enjoyed every minute of it. I love Mercy and can't wait for her to kick some more ass' Lilith Saintcrow Books by Patricia Briggs: The Mercy Thompson books Moon Called Blood Bound Iron Kissed Bone Crossed Silver Borne River Marked Frost Burned Night Broken Fire Touched Silence Fallen Storm Cursed Shifting Shadows (Stories from the world of Mercy Thompson)"
20764879,"A Gathering of Shadows (Shades of Magic, #2)",V.E. Schwab,"Schwab, V.E.",,9780765376497,"=""9780765376473""",0,4.23,Macmillan,Hardcover,512.0,2016.0,2016.0,,2017/01/09,to-read,to-read (#5),to-read,,,,0,0,2016-02-23,513,Fiction,,,"From #1 New York Times bestselling author V.E. Schwab ""Addictive and immersive, A Gathering of Shadows cements this series as a must-read."" —Entertainment Weekly, grade A Four months have passed since the shadow stone fell into Kell's possession. Four months since his path crossed with Delilah Bard. Four months since Rhy was wounded and the Dane twins fell, and the stone was cast with Holland's dying body through the rift, and into Black London. In many ways, things have almost returned to normal, though Rhy is more sober, and Kell is now plagued by his guilt. Restless, and having given up smuggling, Kell is visited by dreams of ominous magical events, waking only to think of Lila, who disappeared from the docks like she always meant to do. As Red London finalizes preparations for the Element Games-an extravagant international competition of magic, meant to entertain and keep healthy the ties between neighboring countries-a certain pirate ship draws closer, carrying old friends back into port. But while Red London is caught up in the pageantry and thrills of the Games, another London is coming back to life, and those who were thought to be forever gone have returned. After all, a shadow that was gone in the night reappears in the morning, and so it seems Black London has risen again-and so to keep magic's balance, another London must fall...in V.E. Schwab's A Gathering of Shadows. Shades of Magic series 1. A Darker Shade of Magic 2. A Gathering of Shadows 3. A Conjuring of Light At the Publisher's request, this title is being sold without Digital Rights Management Software (DRM) applied."
2760772,Es,Stephen King,"King, Stephen",Alexandra von Reinhardt,9783641317690,"=""9783453022539""",5,4.25,Heyne Verlag,Paperback,860.0,1996.0,1986.0,,2017/01/09,,,read,,,,1,0,2023-10-01,2039,Fiction,,,"Drei Horrorklassiker in einem E-Book! Jetzt für kurze Zeit zum Kennenlernpreis (eine befristete Preisaktion des Verlages) ES In Derry, Maine, schlummert das Böse in der Kanalisation: Alle 28 Jahre wacht es auf und muss fressen. Jetzt taucht »ES« wieder empor. Sieben Freunde entschließen sich, dem Grauen entgegenzutreten und ihm ein Ende zu setzen. Stephen Kings Meisterwerk über die Mysterien der Kindheit und den Horror des Erwachsenseins. »Ein Meilenstein der amerikanischen Literatur.« Chicago Sun-Times Sie Schriftsteller Paul hat seine Serienheldin Misery sterben lassen. Nach einem Autounfall hält die Krankenschwester Annie – Pauls »größter Fan« – den verletzten Autor gefangen und zwingt ihn weiterzuschreiben. Oscar für Kathy Bates in der Kinoverfilmung »Misery«. »Man fühlt sich von Zeile zu Zeile immer mehr hineingezogen, wird süchtig von der Droge Spannung.« Die Welt Christine Eine verhängnisvolle Dreiecksbeziehung: Arnie liebt seine Freundin Leigh und »Christine«, seinen 1958er Plymouth Fury. Aber das Auto lebt. Und es ist tödlich eifersüchtig. Verfilmt von Starregisseur John Carpenter. Ein Meisterwerk der modernen Horrorliteratur."
12680,Cujo,Stephen King,"King, Stephen",,9781501141126,"=""9783404130351""",4,3.77,Simon and Schuster,Paperback,351.0,1987.0,1981.0,,2017/01/09,,,read,,,,1,0,2016-01-01,400,Fiction,5,1,"The #1 New York Times bestseller, Cujo “hits the jugular” (The New York Times) with the story of a friendly Saint Bernard that is bitten by a bat. Get ready to meet the most hideous menace ever to terrorize the town of Castle Rock, Maine. Outside a peaceful town in central Maine, a monster is waiting. Cujo is a two-hundred-pound Saint Bernard, the best friend Brett Camber has ever had. One day, Cujo chases a rabbit into a cave inhabited by sick bats and emerges as something new altogether. Meanwhile, Vic and Donna Trenton, and their young son Tad, move to Maine. They are seeking peace and quiet, but life in this small town is not what it seems. As Tad tries to fend off the terror that comes to him at night from his bedroom closet, and as Vic and Donna face their own nightmare of a marriage on the rocks, there is no way they can know that a monster, infinitely sinister, waits in the daylight. What happens to Cujo, how he becomes a horrifying vortex inescapably drawing in all the people around him, makes for one of the most heart-stopping novels Stephen King has ever written. “A genuine page-turner that grabs you and holds you and won’t let go” (Chattanooga Times), Cujo will forever change how you view man’s best friend."
9361589,The Night Circus,Erin Morgenstern,"Morgenstern, Erin",,9781446468265,"=""9780385534635""",0,4.02,Random House,Hardcover,400.0,2011.0,2011.0,,2017/01/09,to-read,to-read (#4),to-read,,,,0,0,2011-09-15,404,Fiction,4.5,16,"THE TIKTOK SENSATION Rediscover the million-copy bestselling fantasy read with a different kind of magic, now in a stunning anniversary edition to mark 10 years since it's paperback debut. The circus arrives without warning. It is simply there, when yesterday it was not. Against the grey sky the towering tents are striped black and white. A sign hanging upon an iron gates reads: Opens at Nightfall Closes at Dawn Full of breath-taking amazements and open only at night, Le Cirque des Rêves seems to cast a spell over all who wander its circular paths. But behind the glittering acrobats, fortune-tellers and contortionists a fierce competition is underway. Celia and Marco are two young magicians who have been trained since childhood for a deadly duel. With the lives of everyone at the Circus of Dreams at stake, they must test the very limits of the imagination, and of their love. Complete the gorgeous anniversary collection with The Starless Sea, the second novel from the author of the The Night Circus, out now. 'The only response to this novel is simply: wow. It is a breathtaking feat of imagination, a flight of fancy that pulls you in and wraps you up in its spell' The Times"
