Book Id,Title,Author,Author l-f,Additional Authors,ISBN,ISBN13,My Rating,Average Rating,Publisher,Binding,Number of Pages,Year Published,Original Publication Year,Date Read,Date Added,Bookshelves,Bookshelves with positions,Exclusive Shelf,My Review,Spoiler,Private Notes,Read Count,Owned Copies,PublishedDate,PageCount,Categories,AverageRating,RatingsCount,Description
36588689,"Die Gefährten (Belgariad Saga, #1)",David Eddings,"Eddings, David",Irmhild Hübner,9783641226558,"=""9783641226558""",5,4.16,Blanvalet Taschenbuch Verlag,Kindle Edition,400.0,2018.0,1982.0,2019/10/20,2019/05/21,,,read,,,,1,0,2018-06-18,400,Fiction,,,"Der Fantasy-Klassiker endlich wieder verfügbar – in überarbeiteter Neuausgabe. Der New-York-Times-Platz-1-Bestsellerautor David Eddings war in den 80er Jahren nicht nur einer der Helden der Fantasy-Leser, sondern ist für viele der erfolgreichen Fantasy-Autoren von heute ein Vorbild. Die Lektüre der Belgariad-Saga ist wie eine Begegnung mit Freunden. Die Charaktere dieser heroischen Coming-of-Age-Fantasy wachsen einem sofort ans Herz, und gemeinsam mit ihnen erforscht man eine wunderbare Welt und kämpft im epischen Kampf zwischen Gut und Böse. Der naive Junge vom Land, der edelste Ritter, der cleverste Dieb, der mächtigste Magier – wer sonst könnte die Welt retten? Dieser Roman ist bereits unter dem Titel »Die Prophezeiung des Bauern« im Knaur-Verlag und unter dem Titel »Kind der Prophezeiung« im Bastei-Lübbe-Verlag erschienen. Er wurde komplett überarbeitet."
17612917,Phoenix,S.F. Said,"Said, S.F.",Dave McKean,9781448157709,"=""9780385618144""",0,4.33,Random House,Hardcover,496.0,2013.0,2013.0,,2019/11/04,to-read,to-read (#41),to-read,,,,0,0,2013-12-05,496,Juvenile Fiction,5,1,"This digital edition includes the original artwork, has been specially adapted for ebook platforms and is optimised for tablet devices. A BOY WITH THE POWER OF A STAR . . . Lucky thinks he's an ordinary Human boy. But one night, he dreams that the stars are singing to him, and wakes to find an uncontrollable power rising inside him. Now he's on the run, racing through space, searching for answers. In a galaxy at war, where Humans and Aliens are deadly enemies, the only people who can help him are an Alien starship crew – and an Alien warrior girl, with neon needles in her hair . . ."
23606648,"The Dagger in the Desk (Lockwood & Co., #1.5)",Jonathan Stroud,"Stroud, Jonathan",,,"=""9781448196944""",0,3.96,,ebook,44.0,2015.0,2013.0,,2019/11/04,to-read,to-read (#40),to-read,,,,0,0,,,,,,
44012031,"Drachenmond (Luna, #3)",Ian McDonald,"McDonald, Ian",Friedrich Mader,9783641193027,"=""9783453317970""",0,3.93,Heyne Verlag,Paperback,464.0,2019.0,2019.0,,2019/11/04,to-read,to-read (#39),to-read,,,,0,0,2019-07-08,576,Fiction,,,"Einhundert Jahre in der Zukunft: Die fünf Drachen, die einflussreichen Familienclans, haben die Herrschaft über den Mond unter sich aufgeteilt. Aber jedes Haus will noch ein wenig mehr Macht, ein wenig mehr Einfluss an sich reißen – und dazu ist ihnen jedes Mittel recht: Eheschließungen, Verschwörungen, Erpressung und sogar Mord. Doch dann taucht ein neuer Spieler auf dem politischen Parkett der Mondgesellschaft auf – und aus im Verborgenen geführten Scharmützeln wird offener Krieg ..."
32810971,"Das Imperium (Imperial Radch, #3)",Ann Leckie,"Leckie, Ann",Bernhard Kempen,,"=""9783453317260""",0,4.21,,Paperback,500.0,2017.0,2015.0,,2019/11/04,to-read,to-read (#38),to-read,,,,0,0,,,,,,
41815341,"Initiate (Animus, #1)",Joshua Anderle,"Anderle, Joshua",Michael Anderle,,"=""""",0,4.29,,Kindle Edition,412.0,2018.0,2018.0,,2019/11/03,to-read,to-read (#37),to-read,,,,0,0,,,,,,
43554718,Der Schwarze Thron: Die Schwestern / Die Königin: Zwei Romane in einem Band,Kendare Blake,"Blake, Kendare",,9783641233440,"=""9783734161872""",0,3.82,Blanvalet Taschenbuch Verlag,Paperback,960.0,2019.0,,,2019/06/03,to-read,to-read (#24),to-read,,,,0,0,2019-03-01,960,Fiction,,,"Drei Schwestern. Drei magische Talente. Nur eine Krone. Das Jahr des Aufstiegs: Ihr ganzes Leben wurden die drei Schwestern ausgebildet, um eines Tages zu regieren. Doch wer die Krone tragen wird, entscheidet ein harter Wettkampf, den nur eine von ihnen gewinnen kann. Game of Crowns – Jetzt die ersten beiden Teile des Fantasy-Epos um den Kampf der Königinnen in einem eBook! Band 1: Die Schwestern Sie sind Schwestern. Sie sind Drillinge, die Töchter der Königin. Jede von ihnen hat das Recht auf den Thron des Inselreichs Fennbirn, aber nur eine wird ihn besteigen können. Mirabella, Katharine und Arsinoe wurden mit verschiedenen magischen Talenten geboren ― doch nur, wer diese auch beherrscht, kann die anderen Schwestern besiegen und die Herrschaft antreten. Vorher aber müssen sie ein grausames Ritual bestehen. Es ist ein Kampf um Leben und Tod ― er beginnt in der Nacht ihres sechzehnten Geburtstages ... Band 2: Die Königin Mirabella, Katharine und Arsinoe sind Drillinge, jede eine Anwärterin auf den Thron der Insel Fennbirn. Ihr Reich verlangt nach einer neuen Königin – doch damit eine von ihnen die Herrschaft erlangen kann, muss sie ihre beiden Schwestern eigenhändig töten. Der Kampf um den Thron ist längst entbrannt, und jede Königin muss sich entscheiden, ob sie leben oder sterben will. Doch während zwei von ihnen noch gegen ihre Bestimmung rebellieren, schreckt die Dritte auf dem Weg zur Krone vor nichts zurück. »Es ist eine Geschichte – fernab von durchgekauten Fantasy-Klischees –, die den Leser in einen unwiderstehlichen Sog zieht.« (Hamburger Morgenpost)"
35126152,"Iron and Magic (The Iron Covenant, #1; World of Kate Daniels, #11)",Ilona Andrews,"Andrews, Ilona",,,"=""9781641970402""",0,4.41,,Paperback,392.0,2018.0,2018.0,,2019/10/20,to-read,to-read (#36),to-read,,,,0,0,,,,,,
34311452,"Year One (Chronicles of The One, #1)",Nora Roberts,"Roberts, Nora",,9781250122988,"=""9781250122957""",0,4.05,St. Martin's Press,Hardcover,419.0,2017.0,2017.0,,2019/10/20,to-read,to-read (#35),to-read,,,,0,0,2017-12-05,430,Fiction,5,2,"#1 NEW YORK TIMES BESTSELLER (December 2017) A stunning new novel from the #1 New York Times bestselling author Nora Roberts—Year One is an epic of hope and horror, chaos and magick, and a journey that will unite a desperate group of people to fight the battle of their lives... It began on New Year’s Eve. The sickness came on suddenly, and spread quickly. The fear spread even faster. Within weeks, everything people counted on began to fail them. The electrical grid sputtered; law and government collapsed—and more than half of the world’s population was decimated. Where there had been order, there was now chaos. And as the power of science and technology receded, magick rose up in its place. Some of it is good, like the witchcraft worked by Lana Bingham, practicing in the loft apartment she shares with her lover, Max. Some of it is unimaginably evil, and it can lurk anywhere, around a corner, in fetid tunnels beneath the river—or in the ones you know and love the most. As word spreads that neither the immune nor the gifted are safe from the authorities who patrol the ravaged streets, and with nothing left to count on but each other, Lana and Max make their way out of a wrecked New York City. At the same time, other travelers are heading west too, into a new frontier. Chuck, a tech genius trying to hack his way through a world gone offline. Arlys, a journalist who has lost her audience but uses pen and paper to record the truth. Fred, her young colleague, possessed of burgeoning abilities and an optimism that seems out of place in this bleak landscape. And Rachel and Jonah, a resourceful doctor and a paramedic who fend off despair with their determination to keep a young mother and three infants in their care alive. In a world of survivors where every stranger encountered could be either a savage or a savior, none of them knows exactly where they are heading, or why. But a purpose awaits them that will shape their lives and the lives of all those who remain. The end has come. The beginning comes next."
36521316,The Shape of Water,Guillermo del Toro,"Toro, Guillermo del",Daniel Kraus,9781250165374,"=""9781250165343""",0,3.89,Feiwel & Friends,Hardcover,315.0,2018.0,2017.0,,2019/10/20,to-read,to-read (#34),to-read,,,,0,0,2018-03-06,384,Fiction,5,1,"The Academy Award's Best Picture of the year is now the New York Times-bestselling, must-read novel of 2018. ""[A] phenomenally enrapturing and reverberating work of art in its own right...[that] vividly illuminates the minds of the characters, greatly enhancing our understanding of their temperaments and predicaments and providing more expansive and involving story lines."" —Booklist Visionary storyteller Guillermo del Toro and celebrated author Daniel Kraus combine their estimable talent in this haunting, heartbreaking love story. It is 1962, and Elisa Esposito—mute her whole life, orphaned as a child—is struggling with her humdrum existence as a janitor working the graveyard shift at Baltimore’s Occam Aerospace Research Center. Were it not for Zelda, a protective coworker, and Giles, her loving neighbor, she doesn’t know how she’d make it through the day. Then, one fateful night, she sees something she was never meant to see, the Center’s most sensitive asset ever: an amphibious man, captured in the Amazon, to be studied for Cold War advancements. The creature is terrifying but also magnificent, capable of language and of understanding emotions...and Elisa can’t keep away. Using sign language, the two learn to communicate. Soon, affection turns into love, and the creature becomes Elisa’s sole reason to live. But outside forces are pressing in. Richard Strickland, the obsessed soldier who tracked the asset through the Amazon, wants nothing more than to dissect it before the Russians get a chance to steal it. Elisa has no choice but to risk everything to save her beloved. With the help of Zelda and Giles, Elisa hatches a plan to break out the creature. But Strickland is on to them. And the Russians are, indeed, coming. Developed from the ground up as a bold two-tiered release—one story interpreted by two artists in the independent mediums of literature and film—The Shape of Water is unlike anything you’ve ever read or seen. “Most movie novelizations do little more than write down what audiences see on the screen. But the novel that’s accompanying Guillermo del Toro’s new movie The Shape of Water is no mere adaptation. Co-author Daniel Kraus’ book and the film tell the same story, of a mute woman who falls in love with an imprisoned and equally mute creature, in two very different ways.” —io9 Praise for The Shape of Water directed by Guillermo del Toro Winner of the 2018 Academy Award for Best Picture Winner of the 2018 Academy Award for Best Director Winner of the 2018 Academy Award for Music (Original Score) Winner of the 2018 Academy Award for Production Design Winner of the 2018 Golden Globe Award for Best Director of a Motion Picture ""With encouragement from critics and awards voters, discerning viewers should make Fox Searchlight’s December release the season’s classiest date movie—for perhaps the greatest of The Shape of Water’s many surprises is how extravagantly romantic it is.” —Variety ""It is never less than magnificent.” —TheDaily Beast ""A visually and emotionally ravishing fantasy that should find a welcome embrace from audiences starved for imaginative escape.” —The Hollywood Reporter Awarded the Golden Lion for Best Film at the74th Annual Venice International Film Festival"
44144248,Lost and Found,Orson Scott Card,"Card, Orson Scott",,1982613416,"=""9781982613419""",0,4.06,,Hardcover,281.0,2019.0,2019.0,,2019/10/20,to-read,to-read (#33),to-read,,,,0,0,2019-09-10,,,,,"Are you really a thief? That's the question that has haunted fourteen-year-old Ezekiel Blast all his life. But he's not a thief, he just has a talent for finding things. Not a superpower-a micropower. Because what good is finding lost bicycles and hair scrunchies, especially when you return them to their owners and everyone thinks you must have stolen them in the first place? If only there were some way to use Ezekiel's micropower for good, to turn a curse into a blessing. His friend Beth thinks there must be, and so does a police detective investigating the disappearance of a little girl. When tragedy strikes, it's up to Ezekiel to use his talent to find what matters most. Master storyteller Orson Scott Card delivers a touching and funny, compelling and smart novel about growing up, harnessing your potential, and finding your place in the world, no matter how old you are."
35132289,"Die Verräterin (Das Imperium der Masken, #1)",Seth Dickinson,"Dickinson, Seth",Jakob Schmidt,9783104902067,"=""""",0,4.06,S. Fischer Verlag,Kindle Edition,519.0,2017.0,2015.0,,2019/10/20,to-read,to-read (#32),to-read,,,,0,0,2017-06-22,518,Fiction,,,"Seth Dickinson ist der provokativste und aufregendste Fantasy-Autor der letzten Jahre. Mit ›Die Verräterin‹ hat er den ersten Roman einer brisanten Fantasy-Trilogie vorgelegt, in der es um die großen Fragen nach Freiheit, Gerechtigkeit, Selbstverwirklichung und Rache geht. Baru Kormoran ist eine junge und hochbegabte Frau, die miterleben muss, wie das Imperium der Masken ihre Heimat Taranoke erobert, ohne einen Tropfen Blut zu vergießen: Der übermächtigen Handelsflotte hat die abgelegene Insel nichts entgegenzusetzen. Anstatt aufzubegehren, lässt Baru sich von den Imperialen anwerben und steigt rasch selbst zu einer Machtposition auf. Ihr Ziel: das Imperium von innen heraus zu zerstören. Von ihren neuen Herren in die Kolonie Aurdwynn versetzt, bekommt sie es alsbald mit einer ganzen Reihe rebellischer Herzogtümer zu tun. Im Kampf um Macht und Freiheit findet sie sich zwischen den Fronten wieder und muss sich fragen, wo sie steht – aufseiten der Rebellion oder des Imperiums. Baru fällt eine Entscheidung, deren Tragweite sie nicht einmal selbst zu ahnen vermag ... »Eine brandneue Fantasy-Serie, die das Potenzial hat, ein würdiger Nachfolger von George R. R. Martin's ›Game of Thrones‹ zu werden.« Adrian Lang"
16058396,"Die Königin (Sonea, #3)",Trudi Canavan,"Canavan, Trudi",,9783641085261,"=""9783764530433""",4,4.03,Penhaligon Verlag,Hardcover,608.0,2012.0,2012.0,,2019/10/20,,,read,,,,1,0,2012-11-12,608,Fiction,,,"Yes, we Canavan! Sonea, die Schwarze Magierin von Kyralia, ist überglücklich, als ihr Sohn Lorkin von den Sachakanischen Rebellen freigelassen wird. Endlich wird er nach Hause zurückkehren. Aber zuvor verlangt der König von Sachaka, dass der junge Mann alle Informationen preisgibt, die er über die Verräterinnen hat. Doch Lorkin hat sich in eine der Rebellinnen verliebt und ist nicht bereit, sie auszuliefern. Der Sachakanische König droht, Lorkin sein Wissen mit Gewalt zu entreißen. Da bricht Sonea das oberste Gesetz für Schwarze Magier und verlässt Kyralia. Sie wird ihren Sohn nicht im Stich lassen – und hofft, dass ihr Eingreifen keinen Krieg auslöst ..."
10117050,"Die Heilerin (Sonea, #2)",Trudi Canavan,"Canavan, Trudi",Michaela Link,3442267501,"=""9783764530426""",4,4.04,,Hardcover,576.0,2011.0,2011.0,,2019/10/20,,,read,,,,1,0,2014-03-17,572,,,,
10238585,"Die Hüterin (Sonea, #1)",Trudi Canavan,"Canavan, Trudi",Michaela Link,9783641046965,"=""9783442377251""",4,3.93,Penhaligon Verlag,Paperback,608.0,2011.0,2010.0,,2019/10/20,,,read,,,,1,0,2010-07-28,392,Fiction,4,8,"Die Rückkehr der schwarzen Magierin Trudi Canavan kehrt dorthin zurück, wo ihr Aufsehen erregender Erfolg begann – zu Sonea und der Gilde der Schwarzen Magier! Zwanzig Jahre sind seit den Ereignissen in der Trilogie „Die Gilde der Schwarzen Magier” vergangen. Auf Wunsch der Gilde hat Sonea nur einem einzigen Magier das Geheimnis der Schwarzen Magie offenbart. Doch sie ist nicht glücklich mit der Wahl, die die Gilde dafür getroffen hat. Kallen ist zwar ein ehrenhafter, aber auch ein harter und zu schnell urteilender Mann. Vielmehr sorgt Sonea sich allerdings um ihren Sohn. Lorkin hat gerade die Abschlussprüfung hinter sich gebracht und brennt jetzt darauf, sich zu beweisen. Daher begleitet er den Botschafter der Gilde nach Sachaka, wo den Magiern Kyralias immer noch unzählige Gefahren drohen. Und tatsächlich verschwindet Lorkin eines Tages ohne ein Wort der Erklärung. Sonea ist beunruhigt, doch sie kann sich nicht einmal an der Suche nach Lorkin beteiligen. Denn in Kyralias Unterwelt tobt ein Krieg, in den auch Magier verwickelt zu sein scheinen – und der alles, was in den Jahren des Friedens aufgebaut wurde, gefährdet ..."
19061929,Skinwalker: Fluch des Blutes,Faith Hunter,"Hunter, Faith",Stefanie Zeller,9783802587184,"=""""",0,4.16,BASTEI LÜBBE,Kindle Edition,449.0,2012.0,2010.0,,2019/10/20,to-read,to-read (#29),to-read,,,,0,0,2012-03-08,453,Fiction,,,"Der Vampirrat von New Orleans hat Jane Yellowrock angeheuert, um einen Vampir zur Strecke zu bringen, der gegen die uralten, heiligen Regeln verstoßen hat. Doch was zunächst als leichter Job erscheint, wird schon bald zu einem gefährlichen Unterfangen, als Jane ein Netz von Intrigen innerhalb der Jahrtausende alten Vampirgemeinschaft aufdeckt. Glücklicherweise kann sie auf die Hilfe des attraktiven Rick La Fleur zählen, der überraschend tiefe Gefühle in der abgebrühten Jägerin weckt."
13335037,"Divergent (Divergent, #1)",Veronica Roth,"Roth, Veronica",,9780062077011,"=""9780062024039""",0,4.15,Harper Collins,Paperback,487.0,2012.0,2011.0,,2019/10/20,to-read,to-read (#28),to-read,,,,0,0,2011-05-03,398,Young Adult Fiction,4.5,345,"This first book in Veronica Roth's #1 New York Times bestselling Divergent series of books is the novel the inspired the major motion picture starring Shailene Woodley, Theo James, and Kate Winslet. This dystopian series set in a futuristic Chicago has captured the hearts of millions of teen and adult readers. Perfect for fans of the Hunger Games and Maze Runner series, Divergent and its sequels, Insurgent and Allegiant, are the gripping story of a dystopian world transformed by courage, self-sacrifice, and love. Fans of the Divergent movie will find the book packed with just as much emotional depth and exhilarating action as the film, all told in beautiful, rich language. One choice can transform you. Beatrice Prior's society is divided into five factions—Candor (the honest), Abnegation (the selfless), Dauntless (the brave), Amity (the peaceful), and Erudite (the intelligent). Beatrice must choose between staying with her Abnegation family and transferring factions. Her choice will shock her community and herself. But the newly christened Tris also has a secret, one she's determined to keep hidden, because in this world, what makes you different makes you dangerous. And don't miss The Fates Divide, Veronica Roth's powerful sequel to the bestselling Carve the Mark!"
2,"Harry Potter and the Order of the Phoenix (Harry Potter, #5)",J.K. Rowling,"Rowling, J.K.",Mary GrandPré,9783551555557,"=""""",5,4.5,,Paperback,912.0,2004.0,2003.0,,2019/10/20,,,read,,,,1,0,2003-11-15,1022,Fiction,,,"Harry Potter ist überzeugt davon, dass Lord Voldemort zurückgekehrt ist. Doch im Zaubereiministerium scheint niemand dem 15-jährigen Teenager Glauben schenken zu wollen. Zum Glück ist da auch noch der Orden des Phönix, eine Gemeinschaft von aufrechten Zauberern, die unter der Führung von Professor Dumbledore im Geheimen für das Gute kämpft."
2767052,"The Hunger Games (The Hunger Games, #1)",Suzanne Collins,"Collins, Suzanne",,9780545229937,"=""9780439023481""",4,4.33,Scholastic Inc.,Hardcover,374.0,2008.0,2008.0,,2019/10/20,,,read,,,,1,0,2009-09-01,387,Young Adult Fiction,4,5878,"This Special Edition of The Hunger Games includes the most extensive interview Suzanne Collins has given since the publication of The Hunger Games; an absorbing behind-the-scenes look at the creation of the series; and an engaging archival conversation between Suzanne Collins and YA legend Walter Dean Myers on writing about war. The Special Edition answers many questions fans have had over the years, and gives great insight into the creation of this era-defining work. In the ruins of a place once known as North America lies the nation of Panem, a shining Capitol surrounded by twelve outlying districts. The Capitol keeps the districts in line by forcing them all to send one boy and one girl between the ages of twelve and eighteen to participate in the annual Hunger Games, a fight to the death on live TV.Sixteen-year-old Katniss Everdeen regards it as a death sentence when she steps forward to take her sister's place in the Games. But Katniss has been close to death before-and survival, for her, is second nature. Still, if she is to win, she will have to start making choices that weigh survival against humanity and life against love."
4473,A Prayer for Owen Meany,John Irving,"Irving, John",,9781448111831,"=""9780552135399""",5,4.24,Random House,Paperback,637.0,1990.0,1989.0,,2019/10/20,,,read,,,,1,0,2012-05-10,79,Fiction,4,2,"'A work of genius' Independent 'Marvellously funny . . . What better entertainment is there than a serious book which makes you laugh?' Spectator 'If you care about something you have to protect it. If you're lucky enough to find a way of life you love, you have to find the courage to live it.' Summer, 1953. In the small town of Gravesend, New Hampshire, eleven-year-old John Wheelwright and his best friend Owen Meany are playing in a Little League baseball game. When Owen hits a foul ball which kills John's mother, their lives are changed in an instant. It is dismissed as a tragic accident but Owen disagrees. He believes that he is God's instrument, put on Earth for a higher purpose. And as the boys come into adulthood to the background of the Vietnam War, a series of remarkable events show that perhaps Owen's divine plan was not imagined after all. Discover the funny yet poignant classic by the bestselling author of The World According to Garp. 'So extraordinary, so original, and so enriching' Stephen King, The Washington Post 'May justly join the classic American list' Anthony Burgess, Observer"
234225,"Dune (Dune, #1)",Frank Herbert,"Herbert, Frank",,9780143111580,"=""9780340839935""",4,4.26,Penguin,Paperback,604.0,2006.0,1965.0,,2019/10/20,,,read,,,,1,0,2016-10-25,722,Fiction,4,1,"NOW A MAJOR MOTION PICTURE directed by Denis Villeneuve and starring Timothée Chalamet, Zendaya, Jason Momoa, Rebecca Ferguson, Oscar Isaac, Josh Brolin, Stellan Skarsgård, Dave Bautista, Stephen McKinley Henderson, Chang Chen, Charlotte Rampling, and Javier Bardem A deluxe hardcover edition of the best-selling science-fiction book of all time—part of Penguin Galaxy, a collectible series of six sci-fi/fantasy classics, featuring a series introduction by Neil Gaiman Winner of the AIGA + Design Observer 50 Books | 50 Covers competition Science fiction’s supreme masterpiece, Dune will be forever considered a triumph of the imagination. Set on the desert planet Arrakis, it is the story of the boy Paul Atreides, who will become the mysterious man known as Muad’Dib. Paul’s noble family is named stewards of Arrakis, whose sands are the only source of a powerful drug called “the spice.” After his family is brought down in a traitorous plot, Paul must go undercover to seek revenge, and to bring to fruition humankind’s most ancient and unattainable dream. A stunning blend of adventure and mysticism, environmentalism and politics, Dune won the first Nebula Award, shared the Hugo Award, and formed the basis of what is undoubtedly the grandest epic in science fiction. Penguin Galaxy Six of our greatest masterworks of science fiction and fantasy, in dazzling collector-worthy hardcover editions, and featuring a series introduction by #1 New York Times bestselling author Neil Gaiman, Penguin Galaxy represents a constellation of achievement in visionary fiction, lighting the way toward our knowledge of the universe, and of ourselves. From historical legends to mythic futures, monuments of world-building to mind-bending dystopias, these touchstones of human invention and storytelling ingenuity have transported millions of readers to distant realms, and will continue for generations to chart the frontiers of the imagination. The Once and Future King by T. H. White Stranger in a Strange Land by Robert A. Heinlein Dune by Frank Herbert 2001: A Space Odyssey by Arthur C. Clarke The Left Hand of Darkness by Ursula K. Le Guin Neuromancer by William Gibson For more than seventy years, Penguin has been the leading publisher of classic literature in the English-speaking world. With more than 1,700 titles, Penguin Classics represents a global bookshelf of the best works throughout history and across genres and disciplines. Readers trust the series to provide authoritative texts enhanced by introductions and notes by distinguished scholars and contemporary authors, as well as up-to-date translations by award-winning translators."
