Book Id,Title,Author,Author l-f,Additional Authors,ISBN,ISBN13,My Rating,Average Rating,Publisher,Binding,Number of Pages,Year Published,Original Publication Year,Date Read,Date Added,Bookshelves,Bookshelves with positions,Exclusive Shelf,My Review,Spoiler,Private Notes,Read Count,Owned Copies,PublishedDate,PageCount,Categories,AverageRating,RatingsCount,Description
34323570,"Furyborn (Empirium, #1)",Claire Legrand,"Legrand, Claire",,9781492656630,"=""9781492656623""",0,3.8,"Sourcebooks, Inc.",Hardcover,501.0,2018.0,2018.0,,2022/08/29,to-read,to-read (#73),to-read,,,,0,0,2018-05-22,523,Young Adult Fiction,4,3,"The first book in the instant New York Times bestselling series, the Empirium Trilogy! Furyborn is an epic YA fantasy about two fiercely independent young women, centuries apart, who hold the power to save their world...or doom it. When assassins ambush her best friend, Rielle Dardenne risks everything to save him, exposing herself as one of a pair of prophesied queens: a queen of light, and one of blood. To prove she is the Sun Queen, Rielle must endure seven elemental magic trials. If she fails, she will be executed as the Blood Queen...unless the trials kill the queen first. One thousand years later, the legend of Queen Rielle is a fairy tale to Eliana Ferracora. A bounty hunter for the Undying Empire, Eliana believes herself untouchable—until her mother vanishes. To find her, Eliana joins a rebel captain and discovers that the evil at the empire's heart is more terrible than she ever imagined. As Rielle and Eliana fight in a cosmic war that spans millennia, their stories intersect, and the shocking connections between them ultimately determine the fate of their world—and of each other. Perfect for: Epic fantasy and dark fantasy YA readers Fans of To Kill A Kingdom and Ash Princess Lovers of dual POVs and epic world building Those who enjoy fiction about strong girls and women The Empirium Trilogy: Furyborn (Book 1) Kingsbane (Book 2) Lightbringer (Book 3) Praise for Furyborn: ""Set in an immersive world of elemental magic, legendary godsbeasts, and cutthroat assassins, Claire Legrand's Furyborn is an addictive, fascinating fantasy."" — Kendare Blake, #1 New York Times bestselling author of the Three Dark Crowns series A BuzzFeed Most Anticipated Title of Spring 2018 A Goodreads Most Anticipated Title of Spring 2018 A Bustle Most Anticipated Title of Spring 2018 ""A must-read."" —Refinery29 ""A series to watch."" —Paste Magazine ""Visionary."" —Bustle ""One of the biggest new YA Fantasies."" —Entertainment Weekly ""Empowering."" —BuzzFeed"
39348113,"Skyward (Skyward, #1)",Brandon Sanderson,"Sanderson, Brandon",,9782253180944,"=""9780399555770""",0,4.49,Le Livre de Poche,Hardcover,510.0,2018.0,2018.0,,2022/08/29,to-read,to-read (#72),to-read,,,,0,0,2020-10-07,662,Fiction,,,"Installés sur la planète Détritus depuis des décennies, les derniers survivants de l’espèce humaine tentent de résister aux attaques répétées des Krell, un mystérieux peuple extraterrestre. Dans ce monde rythmé par les batailles spatiales, les pilotes sont vénérés comme des héros et font frissonner les nouvelles générations prêtes à en découdre. Parmi eux, Spensa rêve depuis l’enfance de piloter son propre vaisseau et de prouver son courage. Car elle est la fille d’un lâche. Son père, l’un des meilleurs pilotes de la Force de Défense Rebelle, a été exécuté lors de la bataille d’Alta après avoir déserté le combat, et cet héritage pourrait bien coûter à Spensa sa place au sein de l’école de pilotage. Plus que jamais déterminée à voler, elle redouble d’effort pour trouver sa place au sein d’une escouade de pilotes et convaincre sa hiérarchie que la lâcheté n’est pas héréditaire. Sa découverte accidentelle d’un vaisseau depuis longtemps oublié pourrait bien changer la donne... Avec cette nouvelle série addictive, Brandon Sanderson, l’auteur best-seller aux 17 millions d’exemplaires vendus à travers le monde, s’approprie les codes de la science-fiction et confirme le talent de conteur qui a fait son succès. Les combats aériens de Brandon Sanderson sont magistraux. Booklist. Traduit de l’anglais (États-Unis) par Mélanie Fazi."
36341204,"What If It's Us (What If It's Us, #1)",Becky Albertalli,"Albertalli, Becky",Adam Silvera,9781471176401,"=""9780062795250""",0,3.83,Simon and Schuster,Hardcover,437.0,2018.0,2018.0,,2022/08/29,to-read,to-read (#71),to-read,,,,0,0,2018-10-18,336,Juvenile Fiction,5,1,"Love Nick and Charlie from Heartstopper? Meet Arthur and Ben! From INTERNATIONAL BESTSELLING authors Adam Silvera (They Both Die At The End) and Becky Albertalli (Simon vs. The Homo Sapiens Agenda) comes a long-awaited collaboration about two very different boys who can't decide if the universe is pushing them together or pulling them apart. Soon to be a feature film, adapted by the creator of 13 Reasons Why! Meet Arthur and Ben. ARTHUR is only in New York for the summer, but if Broadway has taught him anything, it’s that the universe can deliver a showstopping romance when you least expect it. BEN thinks the universe needs to mind its business. If the universe had his back, he wouldn’t be carrying a box of his ex-boyfriend’s things. But when the boys have a chance meeting at the post office, they leave wondering what exactly the universe does have in store for them. What if - in a city of eight million people - they can't find each other again? What if they do ... and then can’t nail a first date even after three do-overs? What if Arthur tries too hard to make it work and Ben doesn’t try hard enough? What if life really isn’t like a Broadway play? But what if it is? What if it's us? PRAISE FOR WHAT IF IT'S US: 'Romantic, realistic and sweet, this perfectly captures New York, teenage love and life in that gray area when you're not quite an adult and not quite a child either.' Lauren James, author of The Loneliest Girl in the Universe PRAISE FOR ADAM SILVERA: 'A phenomenal talent.' Juno Dawson, author of Clean and Wonderland PRAISE FOR BECKY ALBERTALLI: 'The love child of John Green and Rainbow Rowell.' Teen Vogue"
36492488,"We Hunt the Flame (Sands of Arawiya, #1)",Hafsah Faizal,"Faizal, Hafsah",,9780374311568,"=""9780374311544""",0,3.91,"Farrar, Straus and Giroux (BYR)",Hardcover,472.0,2019.0,2019.0,,2022/08/29,to-read,to-read (#70),to-read,,,,0,0,2019-05-14,384,Young Adult Fiction,,,"An Ignyte Award Winner 2020 A TIME Magazine Top 100 Fantasy Book of All Time A BuzzFeed Pick for ""YA Books You Absolutely Must Read This Spring"" A Bustle's Most Anticipated 2019 YA Release A Paste Magazine's Top 10 Most Anticipated YA Novels of 2019 A Paste Magazine Best YA Book of 2019 A PopSugar Best YA Book of 2019 A TeenVogue Book Club Pick for 2019 A Barnes & Noble Teen Book Club Pick for 2019 ""Lyrical and spellbinding"" —Marieke Njikamp, #1 New York Times Bestselling Author Set in a richly detailed world inspired by ancient Arabia, Hafsah Faizal's We Hunt the Flame—first in the Sands of Arawiya duology—is a gripping debut of discovery, conquering fear, and taking identity into your own hands. People lived because she killed. People died because he lived. Zafira is the Hunter, disguising herself as a man when she braves the cursed forest of the Arz to feed her people. Nasir is the Prince of Death, assassinating those foolish enough to defy his autocratic father, the sultan. If Zafira was exposed as a girl, all of her achievements would be rejected; if Nasir displayed his compassion, his father would punish him in the most brutal of ways. Both Zafira and Nasir are legends in the kingdom of Arawiya—but neither wants to be. War is brewing, and the Arz sweeps closer with each passing day, engulfing the land in shadow. When Zafira embarks on a quest to uncover a lost artifact that can restore magic to her suffering world and stop the Arz, Nasir is sent by the sultan on a similar mission: retrieve the artifact and kill the Hunter. But an ancient evil stirs as their journey unfolds—and the prize they seek may pose a threat greater than either can imagine."
28421168,"Renegades (Renegades, #1)",Marissa Meyer,"Meyer, Marissa",,9781509876457,"=""9781250044662""",0,4.14,Pan Macmillan,Hardcover,552.0,2017.0,2017.0,,2022/08/29,to-read,to-read (#69),to-read,,,,0,0,2017-11-16,565,Young Adult Fiction,,,"Secret identities. Extraordinary powers. She wants vengeance. He wants justice. The Renegades are a syndicate of prodigies—humans with extraordinary abilities—who emerged from the ruins of a crumbled society and established peace and order where chaos reigned. As champions of justice, they remain a symbol of hope and courage to everyone . . . except the villains they once overthrew. Nova has a reason to hate the Renegades, and she is on a mission for vengeance. As she gets closer to her target, she meets Adrian, a Renegade boy who believes in justice—and in Nova. But Nova’s allegiance is to a villain who has the power to end them both. From Marissa Meyer, author of the #1 New York Times–bestselling Heartless, comes Renegades a high-stakes world of adventure, passion, danger, and betrayal."
34499221,"To Kill a Kingdom (Hundred Kingdoms, #1)",Alexandra Christo,"Christo, Alexandra",,9781250112682,"=""9781250112682""",0,3.76,St Martin's Press,Hardcover,344.0,2018.0,2018.0,,2022/08/29,to-read,to-read (#68),to-read,,,,0,0,2018-03-06,352,Young Adult Fiction,4,1,"Lira, a famous siren, must prove herself by stealing the heart of the man, a siren-hunting prince who's threatening her race in this action-packed debut."
26032825,"The Cruel Prince (The Folk of the Air, #1)",Holly Black,"Black, Holly",,9780316310284,"=""""",0,4.07,Hachette UK,Hardcover,370.0,2018.0,2018.0,,2022/08/29,to-read,to-read (#67),to-read,,,,0,0,2018-01-02,355,Young Adult Fiction,4,1,"From #1 New York Times bestselling author Holly Black, comes the first book in a stunning new series about a mortal girl who finds herself caught in a web of royal faerie intrigue. Of course I want to be like them. They're beautiful as blades forged in some divine fire. They will live forever. And Cardan is even more beautiful than the rest. I hate him more than all the others. I hate him so much that sometimes when I look at him, I can hardly breathe. Jude was seven years old when her parents were murdered and she and her two sisters were stolen away to live in the treacherous High Court of Faerie. Ten years later, Jude wants nothing more than to belong there, despite her mortality. But many of the fey despise humans. Especially Prince Cardan, the youngest and wickedest son of the High King. To win a place at the Court, she must defy him--and face the consequences. In doing so, she becomes embroiled in palace intrigues and deceptions, discovering her own capacity for bloodshed. But as civil war threatens to drown the Courts of Faerie in violence, Jude will need to risk her life in a dangerous alliance to save her sisters, and Faerie itself."
40024139,"Serpent & Dove (Serpent & Dove, #1)",Shelby Mahurin,"Mahurin, Shelby",,9782378760618,"=""""",0,4.01,De Saxus,Hardcover,513.0,2019.0,2019.0,,2022/08/29,to-read,to-read (#66),to-read,,,,0,0,2021-08-26,416,Juvenile Fiction,,,"De la magie, des sorcières, un choc fantasy de sorcellerie et d'amour interdit signé par l'incroyable et talentueuse Shelby Mahurin. Serpent & Dove est le 1 er tome d'une trilogie qui va vous envouter ! Il y a deux ans, Louise a fui son clan et s'est réfugiée dans la ville de Césarine où les sorcières comme elle sont craintes, chassées et brûlées. La jeune femme a renoncé à la magie et vit désormais de petits larcins. Alors qu'elle prépare le vol d'une bague magique très rare, les évènements vont s'enchaîner pour tout faire basculer dans le chaos. De son côté, Reid, un Chasseur assermenté par l'Église, vit sa vie selon un seul principe : ne pas laisser une seule sorcière en vie. Son chemin n'aurait jamais dû croiser celui de Louise, mais un concours de circonstances va les rapprocher malgré eux et les contraindre à une union impossible et inattendue : le saint mariage. La guerre entre les sorcières et l'Église est ancienne et les dangereux ennemis de Louise représentent une terrible menace. Partagée entre ses sentiments croissants et sa nature, la jeune femme va devoir faire un choix entre le cœur et la raison."
34728667,"Children of Blood and Bone (Legacy of Orïsha, #1)",Tomi Adeyemi,"Adeyemi, Tomi",,9781250170989,"=""9781250170972""",0,4.11,Henry Holt and Company (BYR),Hardcover,544.0,2018.0,2018.0,,2022/08/29,to-read,to-read (#65),to-read,,,,0,0,2018-03-06,543,Young Adult Fiction,3.5,3,"Instant New York Times Bestseller TIME Top 100 Fantasy Books of All Time TIME Best YA Books of All Time TIME 100: Most Influential People of 2020 New York Times Notable Children's Books of 2018 TIME Top 10 Best YA and Children's Books of 2018 NPR's Book Concierge 2018 Great Reads List Buzzfeed's 24 Best YA Books of 2018 Bustle's Top 25 Best Young Adults Books of 2018 2018 Kirkus Prize Finalist YALSA William C. Morris YA Debut Award Finalist Paste Magazine’s 30 Best YA Novels of 2018 Newsweek’s 61 Best Books from 2018 Boston Globe’s Best Children's Books of 2018 Publishers Weekly Best YA Books of 2018 School Library Journal Best Books of 2018 2019 YALSA Teen's Top Ten List With five starred reviews, Tomi Adeyemi’s West African-inspired fantasy debut, and instant #1 New York Times Bestseller, conjures a world of magic and danger, perfect for fans of Leigh Bardugo and Sabaa Tahir. They killed my mother. They took our magic. They tried to bury us. Now we rise. Zélie Adebola remembers when the soil of Orïsha hummed with magic. Burners ignited flames, Tiders beckoned waves, and Zélie’s Reaper mother summoned forth souls. But everything changed the night magic disappeared. Under the orders of a ruthless king, maji were killed, leaving Zélie without a mother and her people without hope. Now Zélie has one chance to bring back magic and strike against the monarchy. With the help of a rogue princess, Zélie must outwit and outrun the crown prince, who is hell-bent on eradicating magic for good. Danger lurks in Orïsha, where snow leoponaires prowl and vengeful spirits wait in the waters. Yet the greatest danger may be Zélie herself as she struggles to control her powers and her growing feelings for an enemy. Praise for Children of Blood and Bone ""A phenomenon."" —Entertainment Weekly “The epic I’ve been waiting for.” —New York Times-bestselling author Marie Lu “You will be changed. You will be ready to rise up and reclaim your own magic!” —New York Times-bestselling author Dhonielle Clayton “The next big thing in literature and film.” —Ebony “One of the biggest young adult fiction debut book deals of the year.” —Teen Vogue This title has Common Core connections. #1 New York Times bestseller, March 14, 2018"
42653408,"Die Verlobten des Winters (Die Spiegelreisenden, #1)",Christelle Dabos,"Dabos, Christelle",,9783458766001,"=""9783458177920""",2,4.05,Suhrkamp Verlag,Hardcover,550.0,2019.0,2013.0,,2020/01/19,,,read,,,,1,0,2019-03-11,435,Juvenile Fiction,5,1,"Ophelia lebt auf der friedlichen Arche Anima. Am liebsten versteckt sie sich hinter ihrer Brille und einem langen Schal. Dabei hat die junge Frau ganz besondere Talente: Sie kann Gegenstände lesen und durch Spiegel reisen. Eines Tages wird ihr Unheilvolles verkündet: Sie soll auf den eisigen Pol ziehen und den Adligen Thorn heiraten. Wer ist dieser Mann, und warum wurde ausgerechnet sie auserkoren? Ophelia macht sich auf den Weg in ihr neues, blitzgefährliches Zuhause, nichtsahnend, welche tödlichen Intrigen sie auf der Reise erwarten ... Eine unvergessliche Heldin, eine atemberaubende Fantasiewelt und eine Geschichte, wie sie noch nicht erzählt wurde – Christelle Dabos hat mit ihrer Serie ein Universum geschaffen, in dem man ewig verweilen möchte."
46117230,Vom glücklichen Leben: Eine Auswahl aus seinen Schriften,Seneca,"Seneca, Seneca",,9783730690796,"=""9783520005151""",3,3.85,Anaconda Verlag,Hardcover,,2018.0,55.0,2022/08/20,2019/12/30,,,read,,,,1,0,2014-12-13,761,Philosophy,,,"Der antike römische Philosoph Seneca war ein freier, unabhängiger Geist. Seine Schriften sind klar formuliert und noch dem heutigen Leser unmittelbar verständlich. Sein humanitär grundiertes Denken kreist um die Kunst der Lebensführung, die zu Seelenruhe und innerer Freiheit führt. Dieser Band dokumentiert Senecas Werk in all seinen Facetten. Er umfasst Schriften wie ‘Von der Seelenruhe’, ‘Vom glücklichen Leben’, ‘Von der Muße’, ‘Von der Kürze des Lebens’, ‘Über die Milde’, ‘Über den Zorn’ sowie sein Hauptwerk, die ‘Moralischen Briefe an Lucilius’."
7748743,"Erebos (Erebos, #1)",Ursula Poznanski,"Poznanski, Ursula",,9783732000968,"=""9783785569573""",4,4.09,Loewe Verlag,Paperback,486.0,2010.0,2010.0,,2020/01/03,,,read,,,,1,0,2013-12-16,488,Juvenile Fiction,4,1,"In einer Londoner Schule wird ein Computerspiel herumgereicht - Erebos. Als Raubkopie geht es von Hand zu Hand und wer es spielt, kommt nicht mehr davon los. Dabei sind die Spielregeln äußerst streng: Jeder hat nur eine Chance, Erebos zu spielen. Er darf mit niemandem darüber reden und muss immer allein spielen. Und - wer gegen die Spielregeln verstößt oder seine Aufgaben nicht erfüllt, fliegt raus und kann das Spiel auch nicht mehr starten. Merkwürdig ist aber, dass die Aufgaben, die Erebos stellt, nicht in der Welt von Erebos, sondern in der Wirklichkeit ausgeführt werden müssen. Die Fiktion des Spiels und die Realität verschwimmen auf irritierende Weise. Auch Nick ist süchtig nach Erebos, bis das Spiel ihm befiehlt, einen Menschen umzubringen. Natürlich führt er diesen Auftrag nicht aus und wird prompt vom Spiel ausgeschlossen. Als auch noch sein bester Freund Jamie schwer verunglückt, begreift Nick: Erebos ist weitaus mehr als nur ein harmloses Computerspiel! AUSZEICHNUNGEN: - Deutscher Jugendliteraturpreis 2011 (Jugendjury) - Ulmer Unke 2010 - Buch des Monats März 2010 (Jubu-Crew Göttingen) Die Spiegel-Bestsellerautorin, auch bekannt durch ihre Jugendromane ""Saeculum"" und ""Die Verratenen"" sowie durch ihre Thriller für Erwachsene: ""Fünf"" und ""Blinde Vögel"", erschienen beim Wunderlich Verlag, widmet sich in ihrem Jugendbuchdebüt dem Thema Online-Rollenspiel. Entstanden ist ein fesselnder und spannender Unterhaltungsroman, sogartig wie das beschriebene Computerspiel und dessen Fantasy-Setting, der sich mit den Gefahren der virtuellen Welten und deren Suchtpotenzial auseinandersetzt. Erebos wurde in mehr als dreißig Sprachen übersetzt, mehrfach mit Preisen ausgezeichnet, u. a. mit dem Deutschen Jugendliteraturpreis."
46195924,Die vergessene Stadt (Zauberschiffe #5),Robin Hobb,"Hobb, Robin",,3442249422,"=""9783946349792""",5,4.46,,Audio CD,,2018.0,2000.0,,2019/10/20,,,read,,,,1,0,2001,510,,,,5. Teil des Fantasy-Zyklus um das lebendig Zauberschiff Viviace. - Fortsetzung von äDie Stunde des Piratenä.
43915,Magician: Apprentice Volume 1  (Raymond E. Feist's Magician: Apprentice #1),Raymond E. Feist,"Feist, Raymond E.","Bryan Jason Lee Glass, Brett Booth, Ryan Stegman",9780007381432,"=""9780785127222""",5,4.45,HarperCollins UK,Hardcover,168.0,2007.0,1984.0,,2022/01/30,,,read,,,,1,0,2012-09-10,706,Fiction,4.5,24,"Magician, available in ebook for the first time, is a masterwork of magic and adventure. The whole of the magnificent Riftwar Cycle, by bestselling author Raymond E. Feist, is now available in ebook"
57623348,"Home: Habitat, Range, Niche, Territory (The Murderbot Diaries, #4.5)",Martha Wells,"Wells, Martha",,,"=""9781250838865""",0,4.09,,ebook,19.0,2021.0,2020.0,,2021/12/21,to-read,to-read (#64),to-read,,,,0,0,,,,,,
54493401,Project Hail Mary,Andy Weir,"Weir, Andy",,9780593135211,"=""9780593135204""",5,4.52,Ballantine Books,Hardcover,476.0,2021.0,2021.0,,2021/07/22,,,read,,,,1,0,2021-05-04,497,Fiction,5,2,"#1 NEW YORK TIMES BESTSELLER • From the author of The Martian, a lone astronaut must save the earth from disaster in this “propulsive” (Entertainment Weekly), cinematic thriller full of suspense, humor, and fascinating science—in development as a major motion picture starring Ryan Gosling. HUGO AWARD FINALIST • ONE OF THE YEAR’S BEST BOOKS: Bill Gates, GatesNotes, New York Public Library, Parade, Newsweek, Polygon, Shelf Awareness, She Reads, Kirkus Reviews, Library Journal • “An epic story of redemption, discovery and cool speculative sci-fi.”—USA Today “If you loved The Martian, you’ll go crazy for Weir’s latest.”—The Washington Post Ryland Grace is the sole survivor on a desperate, last-chance mission—and if he fails, humanity and the earth itself will perish. Except that right now, he doesn’t know that. He can’t even remember his own name, let alone the nature of his assignment or how to complete it. All he knows is that he’s been asleep for a very, very long time. And he’s just been awakened to find himself millions of miles from home, with nothing but two corpses for company. His crewmates dead, his memories fuzzily returning, Ryland realizes that an impossible task now confronts him. Hurtling through space on this tiny ship, it’s up to him to puzzle out an impossible scientific mystery—and conquer an extinction-level threat to our species. And with the clock ticking down and the nearest human being light-years away, he’s got to do it all alone. Or does he? An irresistible interstellar adventure as only Andy Weir could deliver, Project Hail Mary is a tale of discovery, speculation, and survival to rival The Martian—while taking us to places it never dreamed of going."
7520886,Rocannons Welt,Ursula K. Le Guin,"Guin, Ursula K. Le",,OCLC:163759624,"=""9783453304734""",3,3.78,,Paperback,124.0,1978.0,1966.0,2021/10/24,2019/12/30,,,read,,,,1,0,1978,,,,,
37803821,"Das Labyrinth von London (Alex Verus, #1)",Benedict Jacka,"Jacka, Benedict",Michelle Gyo,9783641256463,"=""9783734161650""",0,3.89,Blanvalet Taschenbuch Verlag,Paperback,416.0,2018.0,2012.0,,2021/10/16,to-read,to-read (#63),to-read,,,,0,0,2021-05-17,338,Fiction,,,"Alex Verus hat die magischen Wächter des Weißen Rates immer verabscheut, doch nun bleibt ihm keine andere Wahl: Er wird einer von ihnen! Witzig, originell und durch und durch magisch! Alex Verus' Kampf gegen durchschnittliche Fantasyromane geht in die sechste Runde: Neben körperlicher und geistiger Gesundheit gibt es noch weitere harte Voraussetzungen, um ein Londoner Polizist zu werden. Doch es ist die einzige legale Möglichkeit, die Bösen zu bekämpfen, ohne selbst ein Verbrecher zu werden. Außer man ist magisch begabt wie der Hellseher Alex Verus. In dem Fall kann man den Wächtern beitreten, den Beschützern des übernatürlichen London. Dafür ist nicht einmal geistige Gesundheit nötig, wenn man Alex glauben kann. Möglicherweise wäre diese sogar hinderlich. Aber ein Wächter zu werden ist seine beste Chance, Unterstützung gegen seinen wiedergekehrten Mentor zu erhalten: den Schwarzmagier Richard Drakh. Die Alex-Verus-Bestseller von Benedict Jacka bei Blanvalet: 1. Das Labyrinth von London 2. Das Ritual von London 3. Der Magier von London 4. Der Wächter von London 5. Der Meister von London 6. Das Rätsel von London 7. Die Mörder von London 8. Der Gefangene von London 9. Der Geist von London Weitere Bände in Vorbereitung"
22851350,Ender's Game - Das große Spiel,Orson Scott Card,"Card, Orson Scott",,,"=""9783862016457""",4,4.31,,Paperback,,2013.0,1985.0,,2019/10/20,,,read,,,,1,0,,,,,,
